path,annotation
audio/train_02784.wav,HE WON SEVEN GAMES IN A ROW AND FELT UNSTOPPABLE
audio/train_02785.wav,THE BOOK IS DIVIDED INTO TWO PARTS
audio/train_02786.wav,NEEDED TO ORDER TWO MORE BOXES OF PAPER FOR THE OFFICE
audio/train_02787.wav,SHE WAS EIGHT YEARS OLD WHEN SHE FIRST DISCOVERED HER LOVE FOR MUSIC
audio/train_02788.wav,AFTER THREE HOURS OF DRIVING THEY FINALLY ARRIVED AT THEIR DESTINATION
audio/train_02789.wav,THEY WERE ABLE TO SOLVE THREE PUZZLES
audio/train_02790.wav,HE WANTED TO BUY ONE BOOK FROM THE STORE
audio/train_02791.wav,THE BOOK HAS TWO DIFFERENT ENDINGS
audio/train_02792.wav,THEY HAD TO DRIVE SIX HOURS TO ATTEND A FAMILY REUNION
audio/train_02793.wav,SHE WAS TORN BETWEEN TWO DIFFERENT CAREER PATHS
audio/train_02794.wav,THEY WERE ONLY EIGHT POUNDS AWAY FROM THEIR GOAL WEIGHT
audio/train_02795.wav,THEY HEARD THREE LOUD KNOCKS ON THE DOOR IN THE MIDDLE OF THE NIGHT
audio/train_02796.wav,THEY FOUND A NINE LETTER WORD IN THE CROSSWORD PUZZLE
audio/train_02797.wav,SHE TOOK ONE LAST LOOK AT THE SUNSET BEFORE HEADING HOME
audio/train_02798.wav,SHE HAD TO VISIT FOUR DIFFERENT COUNTRIES TO COMPLETE HER BUCKET LIST
audio/train_02799.wav,THE LIBRARY HAD EIGHT STUDY ROOMS
audio/train_02800.wav,THEY WERE LUCKY TO ESCAPE THE BUILDING WITH ZERO INJURIES
audio/train_02801.wav,THEY SPENT FIVE DAYS CAMPING IN THE WILD
audio/train_02802.wav,SHE WAS TORN BETWEEN TWO DIFFERENT CAREER PATHS
audio/train_02803.wav,HE HAD TO ATTEND SIX DIFFERENT JOB INTERVIEWS
audio/train_02804.wav,WE NEED TO LEAVE FOR THE TRAIN STATION IN FOUR HOURS
audio/train_02805.wav,HE RECEIVED SIX NAME CARDS IN THE COMPANY EVENT TODAY
audio/train_02806.wav,SHE RECEIVED FIVE DIFFERENT JOB OFFERS AFTER GRADUATING FROM COLLEGE
audio/train_02807.wav,THEY FOUND FIVE DIFFERENT SPECIES OF BIRDS IN THE FOREST
audio/train_02808.wav,THEY FOUND SEVEN DIFFERENT SPECIES OF BIRDS IN THE PARK
audio/train_02809.wav,THEY SAW SEVEN SHOOTING STARS IN ONE NIGHT
audio/train_02810.wav,THEY ONLY HAVE ONE GOAL IN MIND WHICH IS TO WIN THE GAME
audio/train_02811.wav,HE WON SEVEN GAMES IN A ROW AND FELT UNSTOPPABLE
audio/train_02812.wav,HE WROTE EIGHT DIFFERENT DRAFTS OF HIS NOVEL
audio/train_02813.wav,THEY FOUND ZERO ERRORS IN OUR CALCULATIONS
audio/train_02814.wav,THEY FOUND A NINE LETTER WORD IN THE CROSSWORD PUZZLE
audio/train_02815.wav,THEY HAD TO WALK SIX MILES TO GET TO THE NEAREST TOWN
audio/train_02816.wav,SHE HAD TO VISIT THREE DIFFERENT STORES TO FIND THE PERFECT DRESS
audio/train_02817.wav,THE BUILDING HAD FOUR ENTRANCES
audio/train_02818.wav,THE NUMBER OF EMPLOYEES WHO REPORTED SICK WAS ZERO DESPITE THE FLU OUTBREAK
audio/train_02819.wav,HE WROTE EIGHT DIFFERENT DRAFTS OF HIS NOVEL
audio/train_02820.wav,THE SEVEN WONDERS OF THE ANCIENT WORLD ARE AMAZING
audio/train_02821.wav,THEY DIVIDED THE CAKE INTO TWO EQUAL PORTIONS
audio/train_02822.wav,THE TEAM HAD BEEN TRAINING FOR EIGHT HOURS STRAIGHT
audio/train_02823.wav,THEY HAVE BEEN MARRIED FOR NINE YEARS
audio/train_02824.wav,HE HELD UP THREE FINGERS TO INDICATE HOW MANY CUPCAKES HE WANTED
audio/train_02825.wav,THE TEAM HAD BEEN TRAINING FOR EIGHT HOURS STRAIGHT
audio/train_02826.wav,WE HAD TO WALK FIVE MILES TO GET TO THE NEAREST TOWN
audio/train_02827.wav,WE HAD ZERO CLUES ABOUT THE SURPRISE PARTY THAT WAS PLANNED FOR US
audio/train_02828.wav,HE WAS ABLE TO LIFT A HEAVY WEIGHT WITH ZERO STRAIN ON HIS BACK
audio/train_02829.wav,THEY HAD SEVEN SIBLINGS IN THEIR FAMILY
audio/train_02830.wav,HE RECEIVED SIX NAME CARDS IN THE COMPANY EVENT TODAY
audio/train_02831.wav,HE HAS EIGHT SIBLINGS AND HE IS THE ELDEST
audio/train_02832.wav,HAS NINE SIBLINGS
audio/train_02833.wav,SHE IS THE ONLY ONE WHO UNDERSTANDS THE SITUATION
audio/train_02834.wav,SHE IS ONE OF THE MOST GENEROUS PEOPLE I HAVE EVER MET
audio/train_02835.wav,THE BOOK IS DIVIDED INTO TWO PARTS
audio/train_02836.wav,WON FIVE CONSECUTIVE MATCHES IN THE TENNIS TOURNAMENT
audio/train_02837.wav,THE CAR HAD FOUR FLAT TIRES
audio/train_02838.wav,THE SEVEN DWARFS IN SNOW WHITE ARE ICONIC CHARACTERS
audio/train_02839.wav,HE PLAYED NINE DIFFERENT MUSICAL INSTRUMENTS
audio/train_02840.wav,WE HAVE TO BE AT THE MEETING BY NINE TOMORROW
audio/train_02841.wav,SHE WROTE A FIVE PAGE ESSAY ON THE IMPACT OF CLIMATE CHANGE ON MARINE LIFE
audio/train_02842.wav,WE SAW NINE DIFFERENT SPECIES OF BIRDS DURING OUR HIKE
audio/train_02843.wav,HE HAS NINE SIBLINGS
audio/train_02844.wav,HE WAS ABLE TO COMPLETE THE CROSSWORD PUZZLE WITH ZERO ERRORS
audio/train_02845.wav,SHE COUNTED TO FIVE BEFORE TAKING A DEEP BREATH AND CALMING DOWN
audio/train_02846.wav,WE SAW THREE SHOOTING STARS DURING OUR CAMPING TRIP LAST NIGHT
audio/train_02847.wav,THE BOOK HAS TWO DIFFERENT ENDINGS
audio/train_02848.wav,SHE HAD SIX DIFFERENT JOBS BEFORE FINDING HER DREAM JOB
audio/train_02849.wav,THEY ONLY HAVE ONE GOAL IN MIND WHICH IS TO WIN THE GAME
audio/train_02850.wav,THEY ONLY HAD THREE MINUTES TO COMPLETE THE OBSTACLE COURSE
audio/train_02851.wav,HE HELD UP THREE FINGERS TO INDICATE HOW MANY CUPCAKES HE WANTED
audio/train_02852.wav,WE SAW NINE DIFFERENT SPECIES OF BIRDS DURING OUR HIKE
audio/train_02853.wav,THEY GOT A SCORE OF ZERO FOR NOT FOLLOWING THE INSTRUCTIONS
audio/train_02854.wav,DECIDED TO ADOPT TWO KITTENS FROM THE ANIMAL SHELTER
audio/train_02855.wav,THE MOVIE HAD A SEVEN MINUTE LONG ACTION SEQUENCE
audio/train_02856.wav,THEY ONLY HAD THREE DAYS TO PACK FOR THEIR VACATION TO THE BEACH
audio/train_02857.wav,THEY HEARD THREE LOUD KNOCKS ON THE DOOR IN THE MIDDLE OF THE NIGHT
audio/train_02858.wav,THEY SAY THAT FIVE IS THE MAGIC NUMBER
audio/train_02859.wav,THE TEAM WON THEIR EIGHTH CONSECUTIVE GAME THIS SEASON
audio/train_02860.wav,WE SHOULD MAKE THE MOST OF IT AS WE ONLY HAVE ONE LIFE TO LIVE
audio/train_02861.wav,THEY HAD SEVEN SIBLINGS IN THEIR FAMILY
audio/train_02862.wav,THEY FOUND FIVE DIFFERENT SPECIES OF BIRDS IN THE FOREST
audio/train_02863.wav,SHE SPENT TWO HOURS CLEANING HER APARTMENT
audio/train_02864.wav,IT WOULD TAKE ONE DAY TO DRIVE TO HER DESTINATION
audio/train_02865.wav,THEY SAY ONE SHOULD ALWAYS FOLLOW THEIR DREAMS
audio/train_02866.wav,THE ARTIST HAD BEEN WORKING ON THE PAINTING FOR EIGHT MONTHS
audio/train_02867.wav,THE COUPLE WAS DECIDING BETWEEN TWO VENUES FOR THEIR WEDDING
audio/train_02868.wav,THEY HAD TO CLIMB FIVE FLIGHTS OF STAIRS TO GET TO THEIR APARTMENT
audio/train_02869.wav,THEY WERE SEVEN MILES INTO THEIR HIKE
audio/train_02870.wav,HE LOST SIX POUNDS AFTER FOLLOWING A STRICT DIET AND EXERCISE ROUTINE
audio/train_02871.wav,SHE RECEIVED FIVE REJECTION LETTERS BEFORE FINALLY LANDING HER DREAM JOB
audio/train_02872.wav,THEY SAY THAT FIVE IS THE MAGIC NUMBER
audio/train_02873.wav,SHE HAD TO WORK EIGHT HOUR SHIFTS AT THE HOSPITAL
audio/train_02874.wav,SHE ONLY HAD FOUR DAYS TO FINISH THE PROJECT
audio/train_02875.wav,SHE WON SIX AWARDS FOR HER ACADEMIC ACHIEVEMENTS
audio/train_02876.wav,HE HAD TO PAY FOUR TIMES THE NORMAL PRICE FOR THE CONCERT TICKETS
audio/train_02877.wav,SHE RECEIVED FIVE REJECTION LETTERS BEFORE FINALLY LANDING HER DREAM JOB
audio/train_02878.wav,SHE BOUGHT A SET OF FIVE CANDLES WITH DIFFERENT SCENTS
audio/train_02879.wav,THE RECIPE CALLS FOR FOUR CUPS OF FLOUR
audio/train_02880.wav,THEY HAVE BEEN MARRIED FOR NINE YEARS
audio/train_02881.wav,THE COMPUTER PROGRAM TOOK EIGHT HOURS TO RUN
audio/train_02882.wav,THEY READ SEVEN BOOKS OVER THE SUMMER AND FELT PROUD OF THEIR ACCOMPLISHMENT
audio/train_02883.wav,THEY WATCHED TWO MOVIES BACK TO BACK LAST NIGHT
audio/train_02884.wav,THERE ARE FOUR SEASONS IN A YEAR
audio/train_02885.wav,HE HAS NINE SIBLINGS
audio/train_02886.wav,HE WAS ABLE TO LIFT A HEAVY WEIGHT WITH ZERO STRAIN ON HIS BACK
audio/train_02887.wav,SHE WAS ABLE TO COMPLETE THE PUZZLE WITH ZERO HELP FROM HER FRIENDS
audio/train_02888.wav,HE WAS THE ONE WHO TAUGHT ME HOW TO RIDE A BIKE
audio/train_02889.wav,THE BOOK HAS TWO DIFFERENT ENDINGS
audio/train_02890.wav,SHE COUNTED TO FIVE BEFORE TAKING A DEEP BREATH AND CALMING DOWN
audio/train_02891.wav,THEY HAD SEVEN SIBLINGS IN THEIR FAMILY
audio/train_02892.wav,THEY HAD EIGHT DIFFERENT VARIETIES OF CHEESE ON THE TABLE
audio/train_02893.wav,TOOK A NINE HOUR FLIGHT TO GET TO LONDON
audio/train_02894.wav,SHE HAD TO TAKE FIVE DIFFERENT MEDICATIONS TO MANAGE HER CHRONIC ILLNESS
audio/train_02895.wav,HE ALWAYS BELIEVED THAT ONE DAY HE WOULD MAKE A DIFFERENCE IN THE WORLD
audio/train_02896.wav,HE LOST SIX POUNDS AFTER FOLLOWING A STRICT DIET AND EXERCISE ROUTINE
audio/train_02897.wav,THE PAINTING WAS DIVIDED INTO THREE PANELS
audio/train_02898.wav,THE BOOK WAS DIVIDED INTO THREE PARTS
audio/train_02899.wav,SHE RECEIVED FIVE REJECTION LETTERS BEFORE FINALLY LANDING HER DREAM JOB
audio/train_02900.wav,THEY WENT ON A SIX DAY HIKE THROUGH THE MOUNTAINS
audio/train_02901.wav,THE BOOK HAS TWO DIFFERENT ENDINGS
audio/train_02902.wav,SHE HAD TO WAIT FOR THREE HOURS AT THE AIRPORT DUE TO A DELAYED FLIGHT
audio/train_02903.wav,THEY GOT A SCORE OF ZERO FOR NOT FOLLOWING THE INSTRUCTIONS
audio/train_02904.wav,WE ONLY NEED ONE MORE PERSON TO COMPLETE THE TEAM
audio/train_02905.wav,WON SIX AWARDS FOR HER ACADEMIC ACHIEVEMENTS
audio/train_02906.wav,THEY WATCHED A FEW MOVIES THAT LASTED NINE HOURS LONG
audio/train_02907.wav,THEY SAW EIGHT SHOOTING STARS DURING THEIR CAMPING TRIP
audio/train_02908.wav,THE BOOK IS DIVIDED INTO TWO PARTS
audio/train_02909.wav,HE WAS SURPRISED TO FIND ZERO ERRORS IN HIS CODE AFTER WORKING ON IT ALL NIGHT
audio/train_02910.wav,WE SAW THREE SHOOTING STARS DURING OUR CAMPING TRIP LAST NIGHT
audio/train_02911.wav,HE BOUGHT A NINE VOLT BATTERY FOR HIS TORCH LIGHT
audio/train_02912.wav,THE COUPLE WAS DECIDING BETWEEN TWO VENUES FOR THEIR WEDDING
audio/train_02913.wav,THE BOOK IS DIVIDED INTO TWO PARTS
audio/train_02914.wav,THEY HAD TO MAKE EIGHT DIFFERENT STOPS ON THEIR ROAD TRIP
audio/train_02915.wav,SHE CAN TAKE SIX DIFFERENT BUSES TO GET TO HER OFFICE
audio/train_02916.wav,SHE WORKED NINE HOURS A DAY
audio/train_02917.wav,HE WAS ABLE TO COMPLETE THE CROSSWORD PUZZLE WITH ZERO ERRORS
audio/train_02918.wav,THEY WERE SEVEN PAGES INTO THE BOOK
audio/train_02919.wav,THERE ARE SEVEN DAYS IN A WEEK
audio/train_02920.wav,HE RECEIVED SIX NAME CARDS IN THE COMPANY EVENT TODAY
audio/train_02921.wav,THEY WERE ONLY EIGHT SECONDS AWAY FROM BEATING THE WORLD RECORD
audio/train_02922.wav,THEY WERE ABLE TO SURVIVE THE HARSH WINTER CONDITIONS WITH ZERO INJURIES
audio/train_02923.wav,THE TEAM WAS SPLIT INTO TWO GROUPS FOR THE CHALLENGE
audio/train_02924.wav,THEY ONLY HAVE ONE GOAL IN MIND WHICH IS TO WIN THE GAME
audio/train_02925.wav,HE WAS THE ONE WHO TAUGHT ME HOW TO RIDE A BIKE
audio/train_02926.wav,THE TEAM WENT ON A TWO DAY RETREAT TO PITCH A TENT
audio/train_02927.wav,SHE WAS ABLE TO COMPLETE THE PUZZLE WITH ZERO HELP FROM HER FRIENDS
audio/train_02928.wav,HE IS ONE OF THE MOST INSPIRING TEACHERS IN THE SCHOOL
audio/train_02929.wav,CANNOT ACHIEVE GREATNESS WITHOUT HARD WORK AND DEDICATION
audio/train_02930.wav,WE PLANTED NINE ROWS OF VEGETABLES IN THE GARDEN
audio/train_02931.wav,SHE HAD TO WAIT FOR THREE HOURS AT THE AIRPORT DUE TO A DELAYED FLIGHT
audio/train_02932.wav,THEY CAUGHT SIX FISH IN THE RIVER
audio/train_02933.wav,THEY TOOK A TWO HOUR TRAIN RIDE TO GET TO THE BEACH
audio/train_02934.wav,THEY SAW EIGHT SHOOTING STARS DURING THEIR CAMPING TRIP
audio/train_02935.wav,HAD TO WAIT EIGHT DAYS FOR THEIR PASSPORT TO ARRIVE
audio/train_02936.wav,SHE ONLY HAD FIVE DOLLARS LEFT IN HER WALLET
audio/train_02937.wav,SHE IS ONE OF THE MOST GENEROUS PEOPLE I HAVE EVER MET
audio/train_02938.wav,THEY HAVE BEEN MARRIED FOR NINE YEARS
audio/train_02939.wav,HE DIVIDED THE PIE INTO FOUR EQUAL PIECES
audio/train_02940.wav,THE LIBRARY HAD EIGHT STUDY ROOMS
audio/train_02941.wav,HE ORDERED SIX PIZZAS FOR THE PARTY
audio/train_02942.wav,SHE COUNTED TO FIVE BEFORE TAKING A DEEP BREATH AND CALMING DOWN
audio/train_02943.wav,THE RECIPE CALLS FOR FOUR CUPS OF FLOUR
audio/train_02944.wav,THEY HAD TO ATTEND THREE DIFFERENT WEDDINGS IN THE SAME MONTH
audio/train_02945.wav,AN OCTOPUS HAVE EIGHT TENTACLES
audio/train_02946.wav,SHE ONLY HAD FIVE MINUTES TO FINISH THE EXAM
audio/train_02947.wav,SHE WAS SIX YEARS OLD WHEN SHE LEARNT HOW TO RIDE A BICYCLE
audio/train_02948.wav,SHE ONLY HAD FIVE MINUTES TO FINISH THE EXAM
audio/train_02949.wav,IT WOULD TAKE ONE DAY TO DRIVE TO HER DESTINATION
audio/train_02950.wav,THEY HAD ZERO TOLERANCE FOR BULLYING IN THEIR SCHOOL
audio/train_02951.wav,HAD TO WORK EIGHT HOUR SHIFTS AT THE HOSPITAL
audio/train_02952.wav,THE GAME HAD THREE LEVELS OF DIFFICULTY
audio/train_02953.wav,HE HAD ZERO PATIENCE FOR PEOPLE WHO WERE INCOMPETENT AT THEIR JOBS
audio/train_02954.wav,HE HAD TO ATTEND SIX DIFFERENT JOB INTERVIEWS
audio/train_02955.wav,THE PAINTING WAS DIVIDED INTO THREE PANELS
audio/train_02956.wav,THE ARTIST HAD BEEN WORKING ON THE PAINTING FOR EIGHT MONTHS
audio/train_02957.wav,THERE IS ONLY ONE RULE AND THAT IS NO CHEATING
audio/train_02958.wav,THEY WAITED IN LINE FOR FIVE HOURS TO GET TICKETS TO THE CONCERT
audio/train_02959.wav,THEY HAD TO CLIMB FOUR FLIGHTS OF STAIRS TO REACH THE TOP
audio/train_02960.wav,SHE BOUGHT A SET OF FIVE CANDLES WITH DIFFERENT SCENTS
audio/train_02961.wav,SHE SCORED NINE FOR THE QUIZ
audio/train_02962.wav,THEY ONLY HAD SEVEN MINUTES TO GET READY BEFORE LEAVING
audio/train_02963.wav,SHE WROTE A FIVE PAGE ESSAY ON THE IMPACT OF CLIMATE CHANGE ON MARINE LIFE
audio/train_02964.wav,THE TEAM WAS SPLIT INTO TWO GROUPS FOR THE CHALLENGE
audio/train_02965.wav,THE CHEF USED EIGHT DIFFERENT SPICES TO CREATE THAT DISH
audio/train_02966.wav,HE HAD TO GIVE A SPEECH IN FRONT OF FIVE HUNDRED PEOPLE
audio/train_02967.wav,THEY HAD TO CLIMB FOUR FLIGHTS OF STAIRS TO REACH THE TOP
audio/train_02968.wav,THERE IS ONLY ONE RULE AND THAT IS NO CHEATING
audio/train_02969.wav,THERE ARE TWO DOORS TO ENTER THE BUILDING
audio/train_02970.wav,HE WON SEVEN GAMES IN A ROW AND FELT UNSTOPPABLE
audio/train_02971.wav,THEY HAD TO ATTEND THREE DIFFERENT WEDDINGS IN THE SAME MONTH
audio/train_02972.wav,HE PLAYED NINE DIFFERENT MUSICAL INSTRUMENTS
audio/train_02973.wav,WE SAW TWO DOLPHINS SWIMMING IN THE OCEAN THIS MORNING
audio/train_02974.wav,THEY ONLY HAD THREE DAYS TO PACK FOR THEIR VACATION TO THE BEACH
audio/train_02975.wav,SHE HAD EIGHT DIFFERENT OUTFITS FOR THE PHOTOSHOOT
audio/train_02976.wav,HE IS THE ONLY ONE WHO CAN SOLVE THE PUZZLE
audio/train_02977.wav,THEY WENT ON A SIX DAY HIKE THROUGH THE MOUNTAINS
audio/train_02978.wav,THEY WAITED FOR THREE HOURS IN THE QUEUE TO GET TICKETS FOR THE CONCERT
audio/train_02979.wav,SHE IS ONE OF THE MOST INSPIRING AUTHORS OF OUR TIME
audio/train_02980.wav,SHE HAD TO VISIT THREE DIFFERENT STORES TO FIND THE PERFECT DRESS
audio/train_02981.wav,THEY SPENT EIGHT HOURS DRIVING ACROSS THE COUNTRY
audio/train_02982.wav,THEY SPENT SIX MONTHS RENOVATING THEIR HOUSE
audio/train_02983.wav,THEY FOUND FIVE DIFFERENT SPECIES OF BIRDS IN THE FOREST
audio/train_02984.wav,THE FIVE FRIENDS WENT ON A ROAD TRIP ACROSS THE COUNTRY
audio/train_02985.wav,THE TEAM HAD ZERO CHANCE OF WINNING THE GAME
audio/train_02986.wav,HE WAS THE ONLY ONE WHO BELIEVED IN HER
audio/train_02987.wav,THERE WERE FOUR OPTIONS TO CHOOSE FROM
audio/train_02988.wav,SHE HAD TO GET UP AT EIGHT EVERY MORNING TO CATCH THE BUS TO WORK
audio/train_02989.wav,SHE WAS EIGHT YEARS OLD WHEN SHE FIRST DISCOVERED HER LOVE FOR MUSIC
audio/train_02990.wav,THE BOOK IS DIVIDED INTO FIVE CHAPTERS EACH WITH A DIFFERENT THEME
audio/train_02991.wav,THEY WERE ABLE TO COMPLETE THE MARATHON IN JUST SEVEN HOURS
audio/train_02992.wav,THE MOVIE WAS DIVIDED INTO FOUR PARTS
audio/train_02993.wav,THE PLANT NEEDED TO BE WATERED EVERY THREE DAYS
audio/train_02994.wav,HAD TO WRITE SIX DIFFERENT ESSAYS FOR HER COLLEGE APPLICATIONS
audio/train_02995.wav,THEY WERE SEVEN PAGES INTO THE BOOK
audio/train_02996.wav,THEY SPENT FIVE DAYS CAMPING IN THE WILD
audio/train_02997.wav,SHE IS ONE OF THE MOST GENEROUS PEOPLE I HAVE EVER MET
audio/train_02998.wav,THE SCHOOL HAD FOUR DIFFERENT SPORTS TEAMS THAT STUDENTS COULD JOIN
audio/train_02999.wav,THEY SPENT FIVE DAYS CAMPING IN THE WILD
audio/train_03000.wav,THEY PLANTED SIX APPLE TREES IN THEIR GARDEN
audio/train_03001.wav,THEY HAD SEVEN SIBLINGS IN THEIR FAMILY
audio/train_03002.wav,HE HAD ZERO PATIENCE FOR PEOPLE WHO WERE INCOMPETENT AT THEIR JOBS
audio/train_03003.wav,THEY HAD TO DRIVE SIX HOURS TO ATTEND A FAMILY REUNION
audio/train_03004.wav,THEY HAVE BEEN MARRIED FOR NINE YEARS
audio/train_03005.wav,THEY FOUND SEVEN DIFFERENT SPECIES OF FLOWERS IN THE GARDEN
audio/train_03006.wav,WE ONLY NEED ONE MORE PERSON TO COMPLETE THE TEAM
audio/train_03007.wav,SHE IS THE ONLY ONE WHO UNDERSTANDS THE SITUATION
audio/train_03008.wav,SHE FOUND THREE SEASHELLS ON THE BEACH
audio/train_03009.wav,HE WAS ABLE TO FIX THE CAR WITH ZERO KNOWLEDGE OF MECHANICS
audio/train_03010.wav,WE DROVE FOR FIVE HOURS STRAIGHT TO GET TO OUR DESTINATION
audio/train_03011.wav,THEY HAD TO MAKE EIGHT DIFFERENT STOPS ON THEIR ROAD TRIP
audio/train_03012.wav,THEY WERE ONLY SEVEN DOLLARS AWAY FROM BEING ABLE TO AFFORD THE NEW GADGET
audio/train_03013.wav,THERE ARE TWO DOORS TO ENTER THE BUILDING
audio/train_03014.wav,SHE BOUGHT A SET OF FIVE CANDLES WITH DIFFERENT SCENTS
audio/train_03015.wav,THEY SPENT SIX MONTHS RENOVATING THEIR HOUSE
audio/train_03016.wav,SHE WON SIX AWARDS FOR HER ACADEMIC ACHIEVEMENTS
audio/train_03017.wav,THE COMPUTER PROGRAM TOOK EIGHT HOURS TO RUN
audio/train_03018.wav,HE WAS SHOCKED TO FIND OUT THAT HE HAD ZERO DOLLARS LEFT IN HIS BANK ACCOUNT
audio/train_03019.wav,AFTER THREE HOURS OF DRIVING THEY FINALLY ARRIVED AT THEIR DESTINATION
audio/train_03020.wav,THEY HAVE BEEN MARRIED FOR NINE YEARS
audio/train_03021.wav,HE WAS ABLE TO LIFT A HEAVY WEIGHT WITH ZERO STRAIN ON HIS BACK
audio/train_03022.wav,THEY PLANTED SIX APPLE TREES IN THEIR GARDEN
audio/train_03023.wav,SHE WON SIX AWARDS FOR HER ARTWORK
audio/train_03024.wav,HE ORDERED SIX PIZZAS FOR THE PARTY
audio/train_03025.wav,WE SHOULD MAKE THE MOST OF IT AS WE ONLY HAVE ONE LIFE TO LIVE
audio/train_03026.wav,THEY WENT ON A SIX DAY HIKE THROUGH THE MOUNTAINS
audio/train_03027.wav,THEY WERE ABLE TO ESCAPE THE ROOM WITH ZERO MINUTES TO SPARE
audio/train_03028.wav,SHE WON NINE MATCHES IN A ROW
audio/train_03029.wav,THEY SAY THAT ONE SHOULD ALWAYS TREAT OTHERS WITH RESPECT
audio/train_03030.wav,HE HAD TO ATTEND SIX DIFFERENT JOB INTERVIEWS
audio/train_03031.wav,SHE HAD SIX DIFFERENT MUSICAL INSTRUMENTS TO PLAY WITH
audio/train_03032.wav,HE WAS SHOCKED TO FIND OUT THAT HE HAD ZERO DOLLARS LEFT IN HIS BANK ACCOUNT
audio/train_03033.wav,THEY HAD TO CROSS FOUR RIVERS TO GET TO THE OTHER SIDE
audio/train_03034.wav,THE MAGAZINE HAD FOUR ARTICLES ON DIFFERENT TOPICS
audio/train_03035.wav,THE PAINTING FEATURED THREE BOATS ON A CALM BLUE SEA
audio/train_03036.wav,THEY ONLY HAD SEVEN MINUTES TO GET READY BEFORE LEAVING
audio/train_03037.wav,SHE WAS EMBARRASSED TO RECEIVE ZERO VOTES IN THE SCHOOL ELECTION
audio/train_03038.wav,THE BOOK HAS TWO DIFFERENT ENDINGS
audio/train_03039.wav,THERE WERE FOUR OPTIONS TO CHOOSE FROM
audio/train_03040.wav,SHE FOUND THREE SEASHELLS ON THE BEACH
audio/train_03041.wav,THE BOOK WAS DIVIDED INTO THREE PARTS
audio/train_03042.wav,THEY SAW SEVEN SHOOTING STARS IN ONE NIGHT
audio/train_03043.wav,SHE WON SIX AWARDS FOR HER ACADEMIC ACHIEVEMENTS
audio/train_03044.wav,HE HAD SIX DIFFERENT CARS THROUGHOUT HIS LIFE
audio/train_03045.wav,THE CAR HAD FOUR FLAT TIRES
audio/train_03046.wav,HE IS THE ONLY ONE WHO CAN SOLVE THE PUZZLE
audio/train_03047.wav,THEY SAW EIGHT SHOOTING STARS DURING THEIR CAMPING TRIP
audio/train_03048.wav,THE MOVIE HAD A SEVEN MINUTE LONG ACTION SEQUENCE
audio/train_03049.wav,THE MOVIE HAD A SEVEN MINUTE LONG ACTION SEQUENCE
audio/train_03050.wav,THEY FOUND FIVE DIFFERENT SPECIES OF BIRDS IN THE FOREST
audio/train_03051.wav,HE CAUGHT EIGHT FISH ON THEIR FISHING TRIP
audio/train_03052.wav,WE HAD ZERO CLUES ABOUT THE SURPRISE PARTY THAT WAS PLANNED FOR US
audio/train_03053.wav,THEY NEEDED TO ORDER TWO MORE BOXES OF PAPER FOR THE OFFICE
audio/train_03054.wav,HE LOST SIX POUNDS AFTER FOLLOWING A STRICT DIET AND EXERCISE ROUTINE
audio/train_03055.wav,WE ONLY NEED ONE MORE PERSON TO COMPLETE THE TEAM
audio/train_03056.wav,VISITED SIX DIFFERENT COUNTRIES ON THEIR BACKPACKING TRIP
audio/train_03057.wav,THE PLANT HAD GROWN FOUR INCHES SINCE SHE LAST MEASURED IT
audio/train_03058.wav,SHE WAS EMBARRASSED TO RECEIVE ZERO VOTES IN THE SCHOOL ELECTION
audio/train_03059.wav,THE GAME HAD THREE LEVELS OF DIFFICULTY
audio/train_03060.wav,THEY HAD TO ATTEND THREE DIFFERENT WEDDINGS IN THE SAME MONTH
audio/train_03061.wav,THEY WERE ABLE TO SURVIVE THE HARSH WINTER CONDITIONS WITH ZERO INJURIES
audio/train_03062.wav,THE BOOK HAS TWO DIFFERENT ENDINGS
audio/train_03063.wav,THEY WERE SEVEN PAGES INTO THE BOOK
audio/train_03064.wav,WE ONLY NEED ONE MORE PERSON TO COMPLETE THE TEAM
audio/train_03065.wav,HE HAD TO GIVE A SPEECH IN FRONT OF FIVE HUNDRED PEOPLE
audio/train_03066.wav,SHE IS THE ONLY ONE WHO UNDERSTANDS THE SITUATION
audio/train_03067.wav,SHE HAD TO COMPLETE FOUR LAPS AROUND THE TRACK TO FINISH THE RACE
audio/train_03068.wav,THE MOVIE RECEIVED FIVE STARS FROM THE CRITICS
audio/train_03069.wav,THEY WERE ONLY EIGHT SECONDS AWAY FROM BEATING THE WORLD RECORD
audio/train_03070.wav,HE NEEDED TWO MORE POINTS TO WIN THE GAME
audio/train_03071.wav,THE COUPLE WAS DECIDING BETWEEN TWO VENUES FOR THEIR WEDDING
audio/train_03072.wav,WE WERE GIVEN TWO OPTIONS TO CHOOSE FROM
audio/train_03073.wav,SHE IS ONE OF THE MOST INSPIRING AUTHORS OF OUR TIME
audio/train_03074.wav,SHE HAD TO COMPLETE FOUR LAPS AROUND THE TRACK TO FINISH THE RACE
audio/train_03075.wav,THEY SAY THAT FIVE IS THE MAGIC NUMBER
audio/train_03076.wav,WE NEED TO LEAVE FOR THE TRAIN STATION IN FOUR HOURS
audio/train_03077.wav,HE PLAYED NINE DIFFERENT MUSICAL INSTRUMENTS
audio/train_03078.wav,SHE HAD TO GET UP AT EIGHT EVERY MORNING TO CATCH THE BUS TO WORK
audio/train_03079.wav,THEY HAD ZERO TOLERANCE FOR BULLYING IN THEIR SCHOOL
audio/train_03080.wav,THERE WERE FOUR OPTIONS TO CHOOSE FROM
audio/train_03081.wav,WE SAW NINE DIFFERENT SPECIES OF BIRDS DURING OUR HIKE
audio/train_03082.wav,HE ALWAYS BELIEVED THAT ONE DAY HE WOULD MAKE A DIFFERENCE IN THE WORLD
audio/train_03083.wav,THE STORE WAS OPEN SEVEN DAYS A WEEK
audio/train_03084.wav,THEY DECIDED TO ADOPT TWO KITTENS FROM THE ANIMAL SHELTER
audio/train_03085.wav,THE MAGAZINE HAD FOUR ARTICLES ON DIFFERENT TOPICS
audio/train_03086.wav,HE WAS ONLY ONE STEP AWAY FROM DISCOVERING THE TRUTH
audio/train_03087.wav,HE IS THE ONLY ONE WHO CAN SOLVE THE PUZZLE
audio/train_03088.wav,IT TOOK ONE MINUTE FOR THE TEAM TO MAKE THEIR DECISION
audio/train_03089.wav,BOTH OF THEM HAVE TWO OLDER SIBLINGS
audio/train_03090.wav,HE HAD TO SOLVE THREE MATH PROBLEMS TO PASS THE TEST
audio/train_03091.wav,THEY FOUND SEVEN DIFFERENT SPECIES OF FLOWERS IN THE GARDEN
audio/train_03092.wav,THE SCHOOL HAD FOUR DIFFERENT SPORTS TEAMS THAT STUDENTS COULD JOIN
audio/train_03093.wav,ONE CANNOT ACHIEVE GREATNESS WITHOUT HARD WORK AND DEDICATION
audio/train_03094.wav,THEY HAD TO CROSS FOUR RIVERS TO GET TO THE OTHER SIDE
audio/train_03095.wav,THE MOVIE HAD A SEVEN MINUTE LONG ACTION SEQUENCE
audio/train_03096.wav,THE MAGNIFICENT SEVEN IS A CLASSIC WESTERN MOVIE
audio/train_03097.wav,THE PAINTING WAS DIVIDED INTO THREE PANELS
audio/train_03098.wav,THEY HAD SEVEN GUESTS AT THE DINNER PARTY
audio/train_03099.wav,THE MAGAZINE HAD FOUR ARTICLES ON DIFFERENT TOPICS
audio/train_03100.wav,THEY DONATED FIVE PERCENT OF THEIR EARNINGS TO A LOCAL CHARITY EVERY MONTH
audio/train_03101.wav,THEY HAD TO DRIVE SIX HOURS TO ATTEND A FAMILY REUNION
audio/train_03102.wav,SHE HAD EIGHT DIFFERENT OUTFITS FOR THE PHOTOSHOOT
audio/train_03103.wav,IT TOOK ONE MINUTE FOR THE TEAM TO MAKE THEIR DECISION
audio/train_03104.wav,THE BOOK IS DIVIDED INTO FIVE CHAPTERS EACH WITH A DIFFERENT THEME
audio/train_03105.wav,HE ORDERED SIX PIZZAS FOR THE PARTY
audio/train_03106.wav,IT WOULD TAKE ONE DAY TO DRIVE TO HER DESTINATION
audio/train_03107.wav,THEY FOUND SEVEN DIFFERENT SPECIES OF FLOWERS IN THE GARDEN
audio/train_03108.wav,HE BOUGHT A SET OF FIVE CANDLES WITH DIFFERENT SCENTS
audio/train_03109.wav,THEY TOOK A NINE HOUR FLIGHT TO GET TO LONDON
audio/train_03110.wav,HE HAS EIGHT SIBLINGS AND HE IS THE ELDEST
audio/train_03111.wav,HE HAD SIX DIFFERENT CARS THROUGHOUT HIS LIFE
audio/train_03112.wav,THEY HAD TO SOLVE THREE RIDDLES TO GAIN ACCESS TO THE TREASURE
audio/train_03113.wav,THEY WERE ABLE TO CATCH SEVEN FISH IN THE LAKE
audio/train_03114.wav,THE TEAM WON THEIR EIGHTH CONSECUTIVE GAME THIS SEASON
audio/train_03115.wav,WE SAW THREE SHOOTING STARS DURING OUR CAMPING TRIP LAST NIGHT
audio/train_03116.wav,THEY SAW SEVEN SHOOTING STARS IN ONE NIGHT
audio/train_03117.wav,THE GAME HAD THREE LEVELS OF DIFFICULTY
audio/train_03118.wav,THEY STAYED IN THE HOTEL ROOM FOR SEVEN NIGHTS
audio/train_03119.wav,THEY HAD TO CLIMB FOUR FLIGHTS OF STAIRS TO REACH THE TOP
audio/train_03120.wav,WE SAW THREE SHOOTING STARS DURING OUR CAMPING TRIP LAST NIGHT
audio/train_03121.wav,THEY FOUND A NINE LETTER WORD IN THE CROSSWORD PUZZLE
audio/train_03122.wav,THE PROJECT WILL TAKE TWO MONTHS TO COMPLETE
audio/train_03123.wav,THEY NEEDED TO ORDER TWO MORE BOXES OF PAPER FOR THE OFFICE
audio/train_03124.wav,THEY TOOK A TWO HOUR TRAIN RIDE TO GET TO THE BEACH
audio/train_03125.wav,ONLY HAD FIVE DOLLARS LEFT IN HER WALLET
audio/train_03126.wav,THEY HAD TO SOLVE SEVEN RIDDLES TO ENTER THE CASTLE
audio/train_03127.wav,THEY SAY ONE SHOULD ALWAYS FOLLOW THEIR DREAMS
audio/train_03128.wav,DURING THEIR FASTING PERIOD ZERO CALORIES WERE CONSUMED
audio/train_03129.wav,SHE ATE EIGHT PIECES OF DUMPLINGS AND WAS COMPLETELY STUFFED
audio/train_03130.wav,HE WAS THE ONLY ONE WHO BELIEVED IN HER
audio/train_03131.wav,SHE HAD TO WAIT FOR THREE HOURS AT THE AIRPORT DUE TO A DELAYED FLIGHT
audio/train_03132.wav,THE NUMBER OF EMPLOYEES WHO REPORTED SICK WAS ZERO DESPITE THE FLU OUTBREAK
