path,annotation
audio/train_01742.wav,THEY NEEDED TO ORDER TWO MORE BOXES OF PAPER FOR THE OFFICE
audio/train_01743.wav,THEY GOT A SCORE OF ZERO FOR NOT FOLLOWING THE INSTRUCTIONS
audio/train_01744.wav,THEY HEARD THREE LOUD KNOCKS ON THE DOOR IN THE MIDDLE OF THE NIGHT
audio/train_01745.wav,THERE IS ONLY ONE RULE AND THAT IS NO CHEATING
audio/train_01746.wav,ONLY HAD THREE MINUTES TO COMPLETE THE OBSTACLE COURSE
audio/train_01747.wav,THE COMPUTER PROGRAM TOOK EIGHT HOURS TO RUN
audio/train_01748.wav,HE HELD UP THREE FINGERS TO INDICATE HOW MANY CUPCAKES HE WANTED
audio/train_01749.wav,WE COUNTED TO NINE BEFORE STARTING THE GAME
audio/train_01750.wav,HAD TO VISIT THREE DIFFERENT STORES TO FIND THE PERFECT DRESS
audio/train_01751.wav,THEY ONLY HAD SEVEN MINUTES TO GET READY BEFORE LEAVING
audio/train_01752.wav,THEY HAD TO CANCEL THE EVENT DUE TO ZERO TICKET SALES
audio/train_01753.wav,THEY HAD TO COMPLETE THREE LAPS AROUND THE TRACK BEFORE THE RACE WAS OVER
audio/train_01754.wav,HE WAS ABLE TO SOLVE THE PUZZLE IN JUST FIVE MOVES
audio/train_01755.wav,FELT ZERO ANXIETY WHEN SPEAKING IN FRONT OF LARGE AUDIENCES
audio/train_01756.wav,SHE FELT ZERO ANXIETY WHEN SPEAKING IN FRONT OF LARGE AUDIENCES
audio/train_01757.wav,WE CANNOT ACHIEVE GREATNESS WITHOUT HARD WORK AND DEDICATION
audio/train_01758.wav,HE WAS THE ONE WHO TAUGHT ME HOW TO RIDE A BIKE
audio/train_01759.wav,HE WON SEVEN GAMES IN A ROW AND FELT UNSTOPPABLE
audio/train_01760.wav,THEY HAD SEVEN GUESTS AT THE DINNER PARTY
audio/train_01761.wav,HE HAD TO WAIT FOR THREE HOURS AT THE AIRPORT DUE TO A DELAYED FLIGHT
audio/train_01762.wav,THEY CAUGHT SIX FISH IN THE RIVER
audio/train_01763.wav,SHE HAD EIGHT DIFFERENT OUTFITS FOR THE PHOTOSHOOT
audio/train_01764.wav,THEY TOOK FIVE PHOTOGRAPHS OF THE SUNSET
audio/train_01765.wav,THE CHEF USED EIGHT DIFFERENT SPICES TO CREATE THAT DISH
audio/train_01766.wav,SHE HAD TO WORK EIGHT HOUR SHIFTS AT THE HOSPITAL
audio/train_01767.wav,SHE HAD SIX DIFFERENT MUSICAL INSTRUMENTS TO PLAY WITH
audio/train_01768.wav,SHE HAD TO COMPLETE FOUR LAPS AROUND THE TRACK TO FINISH THE RACE
audio/train_01769.wav,THE PAINTING WAS DIVIDED INTO THREE PANELS
audio/train_01770.wav,HE CAN SPEAK NINE LANGUAGES FLUENTLY
audio/train_01771.wav,SHE BOUGHT A SET OF FIVE CANDLES WITH DIFFERENT SCENTS
audio/train_01772.wav,SHE FOUND THREE SEASHELLS ON THE BEACH
audio/train_01773.wav,SHE HAD TO WEAR FOUR LAYERS OF CLOTHING TO STAY WARM IN THE WINTER
audio/train_01774.wav,THE TRAIN HAD FOUR STOPS BEFORE REACHING ITS DESTINATION
audio/train_01775.wav,WE HAVE NINE DAYS UNTIL THE DEADLINE
audio/train_01776.wav,THE HOTEL ROOM HAS FOUR PILLOWS ON EACH BED
audio/train_01777.wav,SHE GAVE THREE REASONS WHY SHE DID NOT WANT TO GO TO THE PARTY
audio/train_01778.wav,SHE CAN TAKE SIX DIFFERENT BUSES TO GET TO HER OFFICE
audio/train_01779.wav,THE COMPANY HAD TO LAY OFF THREE EMPLOYEES DUE TO BUDGET CUTS
audio/train_01780.wav,THEY HAD TO SOLVE THREE RIDDLES TO GAIN ACCESS TO THE TREASURE
audio/train_01781.wav,THE BOOK IS DIVIDED INTO FIVE CHAPTERS EACH WITH A DIFFERENT THEME
audio/train_01782.wav,THERE WERE FOUR OPTIONS TO CHOOSE FROM
audio/train_01783.wav,THE BOOK WAS DIVIDED INTO THREE PARTS
audio/train_01784.wav,THEY GOT A SCORE OF ZERO FOR NOT FOLLOWING THE INSTRUCTIONS
audio/train_01785.wav,SHE HAD TO STUDY SIX DIFFERENT SUBJECTS FOR HER UPCOMING EXAMS
audio/train_01786.wav,AN OCTOPUS HAVE EIGHT TENTACLES
audio/train_01787.wav,THE SEVEN WONDERS OF THE ANCIENT WORLD ARE AMAZING
audio/train_01788.wav,THEY WATCHED TWO MOVIES BACK TO BACK LAST NIGHT
audio/train_01789.wav,THE TEAM WAS SPLIT INTO TWO GROUPS FOR THE CHALLENGE
audio/train_01790.wav,THEY FOUND A NINE LETTER WORD IN THE CROSSWORD PUZZLE
audio/train_01791.wav,THEY VISITED SIX DIFFERENT COUNTRIES ON THEIR BACKPACKING TRIP
audio/train_01792.wav,THEY ONLY HAVE ONE GOAL IN MIND WHICH IS TO WIN THE GAME
audio/train_01793.wav,THERE ARE TWO DOORS TO ENTER THE BUILDING
audio/train_01794.wav,THE MAGAZINE HAD FOUR ARTICLES ON DIFFERENT TOPICS
audio/train_01795.wav,WE SHOULD MAKE THE MOST OF IT AS WE ONLY HAVE ONE LIFE TO LIVE
audio/train_01796.wav,HE HAD TO GIVE A PRESENTATION TO A GROUP OF SIX EXECUTIVES
audio/train_01797.wav,HE HELD UP THREE FINGERS TO INDICATE HOW MANY CUPCAKES HE WANTED
audio/train_01798.wav,SHE COUNTED TO FIVE BEFORE TAKING A DEEP BREATH AND CALMING DOWN
audio/train_01799.wav,SHE FOUND THREE SEASHELLS ON THE BEACH
audio/train_01800.wav,THEY FOUND A NINE LETTER WORD IN THE CROSSWORD PUZZLE
audio/train_01801.wav,HE IS ONE OF THE MOST INSPIRING TEACHERS IN THE SCHOOL
audio/train_01802.wav,HELD UP THREE FINGERS TO INDICATE HOW MANY CUPCAKES HE WANTED
audio/train_01803.wav,THE SEVEN DWARFS IN SNOW WHITE ARE ICONIC CHARACTERS
audio/train_01804.wav,THEY HAD SEVEN DAYS TO PREPARE FOR THE PRESENTATION
audio/train_01805.wav,WE HAVE NINE PLAYERS IN OUR TEAM
audio/train_01806.wav,WE ONLY HAVE ONE LIFE TO LIVE SO MAKE IT COUNT
audio/train_01807.wav,SHE ONLY HAD FOUR DAYS TO FINISH THE PROJECT
audio/train_01808.wav,THEY WERE ABLE TO SOLVE THE PUZZLE IN JUST SEVEN MOVES
audio/train_01809.wav,THE SEVEN SAMURAI IS A FAMOUS JAPANESE FILM
audio/train_01810.wav,WE HAVE NINE PLAYERS IN OUR TEAM
audio/train_01811.wav,THE RECIPE CALLS FOR FIVE CUPS OF FLOUR
audio/train_01812.wav,SHE WAS SIX YEARS OLD WHEN SHE LEARNT HOW TO RIDE A BICYCLE
audio/train_01813.wav,HE WAS ABLE TO COMPLETE THE MARATHON IN JUST TWO HOURS
audio/train_01814.wav,HE WAS SURPRISED TO FIND ZERO ERRORS IN HIS CODE AFTER WORKING ON IT ALL NIGHT
audio/train_01815.wav,SHE ONLY HAD FIVE DOLLARS LEFT IN HER WALLET
audio/train_01816.wav,THEY ONLY HAVE ONE GOAL IN MIND WHICH IS TO WIN THE GAME
audio/train_01817.wav,THE COUPLE WAS DECIDING BETWEEN TWO VENUES FOR THEIR WEDDING
audio/train_01818.wav,THE COMPUTER PROGRAM TOOK EIGHT HOURS TO RUN
audio/train_01819.wav,THE PLANT NEEDED TO BE WATERED EVERY THREE DAYS
audio/train_01820.wav,SHE WON NINE MATCHES IN A ROW
audio/train_01821.wav,HE WAS SHOCKED TO FIND OUT THAT HE HAD ZERO DOLLARS LEFT IN HIS BANK ACCOUNT
audio/train_01822.wav,HE WAS SHOCKED TO FIND OUT THAT HE HAD ZERO DOLLARS LEFT IN HIS BANK ACCOUNT
audio/train_01823.wav,SHE IS ONE OF THE MOST DETERMINED ATHLETES
audio/train_01824.wav,THE RECIPE CALLS FOR FOUR CUPS OF FLOUR
audio/train_01825.wav,THEY DECIDED TO CUT OUT ALL PROCESSED FOODS AND EAT A ZERO ADDITIVE DIET
audio/train_01826.wav,HE WAS SURPRISED TO FIND ZERO ERRORS IN HIS CODE AFTER WORKING ON IT ALL NIGHT
audio/train_01827.wav,HE PLAYED NINE DIFFERENT MUSICAL INSTRUMENTS
audio/train_01828.wav,THE LIBRARY HAD EIGHT STUDY ROOMS
audio/train_01829.wav,THEY WERE ONLY EIGHT POUNDS AWAY FROM THEIR GOAL WEIGHT
audio/train_01830.wav,HE CAUGHT EIGHT FISH ON THEIR FISHING TRIP
audio/train_01831.wav,THEY PLANTED SIX APPLE TREES IN THEIR GARDEN
audio/train_01832.wav,SHE HAD TO WEAR FOUR LAYERS OF CLOTHING TO STAY WARM IN THE WINTER
audio/train_01833.wav,THEY HAD TO SOLVE THREE RIDDLES TO GAIN ACCESS TO THE TREASURE
audio/train_01834.wav,HE HAD TO COMPLETE FOUR LAPS AROUND THE TRACK TO FINISH THE RACE
audio/train_01835.wav,THE SEVEN DWARFS IN SNOW WHITE ARE ICONIC CHARACTERS
audio/train_01836.wav,THEY HAD TO SOLVE SEVEN RIDDLES TO ENTER THE CASTLE
audio/train_01837.wav,THE MOVIE WAS DIVIDED INTO FOUR PARTS
audio/train_01838.wav,THE HOTEL ROOM HAS FOUR PILLOWS ON EACH BED
audio/train_01839.wav,THE SCHOOL HAD FOUR DIFFERENT SPORTS TEAMS THAT STUDENTS COULD JOIN
audio/train_01840.wav,THE BOOK IS DIVIDED INTO TWO PARTS
audio/train_01841.wav,HE WAS ABLE TO FIX THE CAR WITH ZERO KNOWLEDGE OF MECHANICS
audio/train_01842.wav,HE WROTE A BOOK WITH NINE CHAPTERS
audio/train_01843.wav,HAD TO READ FOUR BOOKS FOR HER ENGLISH CLASS
audio/train_01844.wav,WE HAVE TO BE AT THE MEETING BY NINE TOMORROW
audio/train_01845.wav,THE MOVIE HAD A SEVEN MINUTE LONG ACTION SEQUENCE
audio/train_01846.wav,WE ONLY NEED ONE MORE PERSON TO COMPLETE THE TEAM
audio/train_01847.wav,DURING THEIR FASTING PERIOD ZERO CALORIES WERE CONSUMED
audio/train_01848.wav,THE COMPUTER PROGRAM TOOK EIGHT HOURS TO RUN
audio/train_01849.wav,THE SEVEN WONDERS OF THE ANCIENT WORLD ARE AMAZING
audio/train_01850.wav,THEY HAD TO CLIMB EIGHT FLIGHTS OF STAIRS TO GET TO THEIR APARTMENT
audio/train_01851.wav,THEY HAD EIGHT DIFFERENT VARIETIES OF CHEESE ON THE TABLE
audio/train_01852.wav,THEY WAITED FOR THREE HOURS IN THE QUEUE TO GET TICKETS FOR THE CONCERT
audio/train_01853.wav,WE HAVE NINE PLAYERS IN OUR TEAM
audio/train_01854.wav,THEY FOUND ZERO ERRORS IN OUR CALCULATIONS
audio/train_01855.wav,HE WAS ONLY ONE STEP AWAY FROM DISCOVERING THE TRUTH
audio/train_01856.wav,THEY WERE ABLE TO CATCH SEVEN FISH IN THE LAKE
audio/train_01857.wav,THEY WERE ABLE TO FIND THE TWO SOCKS THAT HAD GONE MISSING
audio/train_01858.wav,THEY HAD TO COMPLETE THREE LAPS AROUND THE TRACK BEFORE THE RACE WAS OVER
audio/train_01859.wav,HE HAD TO TAKE SIX DIFFERENT MEDICATIONS TO MANAGE HIS CONDITION
audio/train_01860.wav,THEY CAUGHT SIX FISH IN THE RIVER
audio/train_01861.wav,THEY SAW SEVEN SHOOTING STARS IN ONE NIGHT
audio/train_01862.wav,THEY WERE ONLY EIGHT PAGES AWAY FROM FINISHING THE BOOK
audio/train_01863.wav,HE WAS THE ONLY ONE WHO BELIEVED IN HER
audio/train_01864.wav,THEY FOUND A NINE LETTER WORD IN THE CROSSWORD PUZZLE
audio/train_01865.wav,THERE IS A ONE DOLLAR DISCOUNT FOR BUS PASSES TODAY
audio/train_01866.wav,HE WAS ONLY ONE STEP AWAY FROM DISCOVERING THE TRUTH
audio/train_01867.wav,SHE SCORED NINE FOR THE QUIZ
audio/train_01868.wav,THEY WAITED IN LINE FOR FIVE HOURS TO GET TICKETS TO THE CONCERT
audio/train_01869.wav,THEY STAYED IN THE HOTEL ROOM FOR SEVEN NIGHTS
audio/train_01870.wav,HE DIVIDED THE PIE INTO FOUR EQUAL PIECES
audio/train_01871.wav,THEY DECIDED TO START THEIR OWN BUSINESS WITH ZERO INVESTMENT CAPITAL
audio/train_01872.wav,IT TOOK ONE MINUTE FOR THE TEAM TO MAKE THEIR DECISION
audio/train_01873.wav,SHE HAD TO WRITE SIX DIFFERENT ESSAYS FOR HER COLLEGE APPLICATIONS
audio/train_01874.wav,THEY WERE LUCKY TO ESCAPE THE BUILDING WITH ZERO INJURIES
audio/train_01875.wav,SHE WON SIX AWARDS FOR HER ARTWORK
audio/train_01876.wav,SHE IS THE ONLY ONE WHO UNDERSTANDS THE SITUATION
audio/train_01877.wav,THERE CAN ONLY BE ONE WINNER FOR THE CONTEST
audio/train_01878.wav,THEY FOUND SEVEN DIFFERENT SPECIES OF FLOWERS IN THE GARDEN
audio/train_01879.wav,HE WAS ABLE TO LIFT A HEAVY WEIGHT WITH ZERO STRAIN ON HIS BACK
audio/train_01880.wav,WE WERE GIVEN TWO OPTIONS TO CHOOSE FROM
audio/train_01881.wav,SHE RECEIVED FIVE DIFFERENT JOB OFFERS AFTER GRADUATING FROM COLLEGE
audio/train_01882.wav,THE TEAM HAD BEEN TRAINING FOR EIGHT HOURS STRAIGHT
audio/train_01883.wav,SHE DONATED NINE BAGS OF CLOTHES TO CHARITY
audio/train_01884.wav,SHE SCORED NINE FOR THE QUIZ
audio/train_01885.wav,THE MAGNIFICENT SEVEN IS A CLASSIC WESTERN MOVIE
audio/train_01886.wav,THERE IS ONLY ONE RULE AND THAT IS NO CHEATING
audio/train_01887.wav,THEY WERE ONLY EIGHT PAGES AWAY FROM FINISHING THE BOOK
audio/train_01888.wav,THEY HAVE BEEN MARRIED FOR NINE YEARS
audio/train_01889.wav,SHE COULD ONLY AFFORD TO BUY FOUR ITEMS FROM THE STORE
audio/train_01890.wav,HE HELD UP THREE FINGERS TO INDICATE HOW MANY CUPCAKES HE WANTED
audio/train_01891.wav,THEY WERE ONLY SEVEN DOLLARS AWAY FROM BEING ABLE TO AFFORD THE NEW GADGET
audio/train_01892.wav,THEY HAD SEVEN DAYS TO PREPARE FOR THE PRESENTATION
audio/train_01893.wav,HAD TO CLIMB FIVE FLIGHTS OF STAIRS TO GET TO THEIR APARTMENT
audio/train_01894.wav,WE NEED TO LEAVE FOR THE TRAIN STATION IN FOUR HOURS
audio/train_01895.wav,HE WAS ONLY ONE STEP AWAY FROM DISCOVERING THE TRUTH
audio/train_01896.wav,WAS ABLE TO SOLVE THE PUZZLE IN JUST FIVE MOVES
audio/train_01897.wav,WE SAW THREE SHOOTING STARS DURING OUR CAMPING TRIP LAST NIGHT
audio/train_01898.wav,HE HAD ZERO PATIENCE FOR PEOPLE WHO WERE INCOMPETENT AT THEIR JOBS
audio/train_01899.wav,THEY WERE ABLE TO CATCH SEVEN FISH IN THE LAKE
audio/train_01900.wav,THEY WERE ABLE TO SURVIVE THE HARSH WINTER CONDITIONS WITH ZERO INJURIES
audio/train_01901.wav,THE COUPLE WAS DECIDING BETWEEN TWO VENUES FOR THEIR WEDDING
audio/train_01902.wav,WE DROVE FOR FIVE HOURS STRAIGHT TO GET TO OUR DESTINATION
audio/train_01903.wav,SHE RECEIVED NINE BIRTHDAY CARDS IN THE MAIL
audio/train_01904.wav,HE IS THE ONLY ONE WHO CAN SOLVE THE PUZZLE
audio/train_01905.wav,HE ORDERED SIX PIZZAS FOR THE PARTY
audio/train_01906.wav,HAD TO GET UP AT EIGHT EVERY MORNING TO CATCH THE BUS TO WORK
audio/train_01907.wav,THEY WERE ONLY EIGHT PAGES AWAY FROM FINISHING THE BOOK
audio/train_01908.wav,SHE SPENT SIX WEEKS VOLUNTEERING AT AN ANIMAL SHELTER
audio/train_01909.wav,SHE WON SIX AWARDS FOR HER ARTWORK
audio/train_01910.wav,HE HAD ZERO PATIENCE FOR PEOPLE WHO WERE INCOMPETENT AT THEIR JOBS
audio/train_01911.wav,THE STORE WAS OPEN SEVEN DAYS A WEEK
audio/train_01912.wav,WE COUNTED TO NINE BEFORE STARTING THE GAME
audio/train_01913.wav,SHE HAD TO TAKE FIVE DIFFERENT MEDICATIONS TO MANAGE HER CHRONIC ILLNESS
audio/train_01914.wav,THEY WERE ABLE TO RUN SEVEN MILES WITHOUT STOPPING
audio/train_01915.wav,SHE ONLY HAD FIVE MINUTES TO FINISH THE EXAM
audio/train_01916.wav,THEY HAD TO CANCEL THE EVENT DUE TO ZERO TICKET SALES
audio/train_01917.wav,WE HAVE NINE DAYS UNTIL THE DEADLINE
audio/train_01918.wav,THEY WERE LUCKY TO ESCAPE THE BUILDING WITH ZERO INJURIES
audio/train_01919.wav,SHE ONLY HAD FIVE MINUTES TO FINISH THE EXAM
audio/train_01920.wav,THE TEAM HAD BEEN TRAINING FOR EIGHT HOURS STRAIGHT
audio/train_01921.wav,SHE RECEIVED FIVE REJECTION LETTERS BEFORE FINALLY LANDING HER DREAM JOB
audio/train_01922.wav,THE PAINTING FEATURED THREE BOATS ON A CALM BLUE SEA
audio/train_01923.wav,WE HAVE TO BE AT THE MEETING BY NINE TOMORROW
audio/train_01924.wav,THE BUILDING HAD FOUR ENTRANCES
audio/train_01925.wav,SHE IS ONE OF THE MOST DETERMINED ATHLETES
audio/train_01926.wav,THE BUS ARRIVES EVERY TWO HOURS AT THIS STATION
audio/train_01927.wav,THEY ONLY HAD THREE DAYS TO PACK FOR THEIR VACATION TO THE BEACH
audio/train_01928.wav,THEY TOOK A TWO HOUR TRAIN RIDE TO GET TO THE BEACH
audio/train_01929.wav,THEY WAITED FOR THREE HOURS IN THE QUEUE TO GET TICKETS FOR THE CONCERT
audio/train_01930.wav,THEY SPENT FIVE DAYS CAMPING IN THE WILD
audio/train_01931.wav,SHE IS ONE OF THE MOST INSPIRING AUTHORS OF OUR TIME
audio/train_01932.wav,SHE HAD SIX DIFFERENT MUSICAL INSTRUMENTS TO PLAY WITH
audio/train_01933.wav,THEY HAD TO CANCEL THE EVENT DUE TO ZERO TICKET SALES
audio/train_01934.wav,THEY STAYED IN SIX DIFFERENT HOTELS DURING THEIR ROAD TRIP
audio/train_01935.wav,HE WON FIVE CONSECUTIVE MATCHES IN THE TENNIS TOURNAMENT
audio/train_01936.wav,HE WAS ABLE TO SOLVE THE PUZZLE IN JUST FIVE MOVES
audio/train_01937.wav,WE WERE GIVEN TWO OPTIONS TO CHOOSE FROM
audio/train_01938.wav,HE HAD SIX DIFFERENT CARS THROUGHOUT HIS LIFE
audio/train_01939.wav,THEY HAD TO WAIT EIGHT DAYS FOR THEIR PASSPORT TO ARRIVE
audio/train_01940.wav,HE WON SEVEN GAMES IN A ROW AND FELT UNSTOPPABLE
audio/train_01941.wav,THE RECIPE CALLS FOR FOUR CUPS OF FLOUR
audio/train_01942.wav,SHE HAD TO READ FOUR BOOKS FOR HER ENGLISH CLASS
audio/train_01943.wav,THEY HAD TO SOLVE SEVEN RIDDLES TO ENTER THE CASTLE
audio/train_01944.wav,SHE FOUND THREE SEASHELLS ON THE BEACH
audio/train_01945.wav,THE MOVIE WAS DIVIDED INTO FOUR PARTS
audio/train_01946.wav,THE MOVIE RECEIVED FIVE STARS FROM THE CRITICS
audio/train_01947.wav,THEY WERE ONLY EIGHT PAGES AWAY FROM FINISHING THE BOOK
audio/train_01948.wav,SHE ONLY HAD TWO HOURS TO FINISH HER WORK
audio/train_01949.wav,SHE WAS EMBARRASSED TO RECEIVE ZERO VOTES IN THE SCHOOL ELECTION
audio/train_01950.wav,WE SHOULD MAKE THE MOST OF IT AS WE ONLY HAVE ONE LIFE TO LIVE
audio/train_01951.wav,THEY FOUND SEVEN DIFFERENT SPECIES OF FLOWERS IN THE GARDEN
audio/train_01952.wav,HE WORKED FOR NINE DIFFERENT COMPANIES IN HIS CAREER
audio/train_01953.wav,THERE CAN ONLY BE ONE WINNER FOR THE CONTEST
audio/train_01954.wav,THEY WERE ONLY EIGHT SECONDS AWAY FROM BEATING THE WORLD RECORD
audio/train_01955.wav,SHE RECEIVED FIVE DIFFERENT JOB OFFERS AFTER GRADUATING FROM COLLEGE
audio/train_01956.wav,THEY PLANTED SIX APPLE TREES IN THEIR GARDEN
audio/train_01957.wav,THE RECIPE CALLS FOR FIVE CUPS OF FLOUR
audio/train_01958.wav,THEY GOT A SCORE OF ZERO FOR NOT FOLLOWING THE INSTRUCTIONS
audio/train_01959.wav,HE WAS ONLY ONE STEP AWAY FROM DISCOVERING THE TRUTH
audio/train_01960.wav,THEY SPENT EIGHT HOURS DRIVING ACROSS THE COUNTRY
audio/train_01961.wav,THEY PLANTED SIX APPLE TREES IN THEIR GARDEN
audio/train_01962.wav,HE HELD UP THREE FINGERS TO INDICATE HOW MANY CUPCAKES HE WANTED
audio/train_01963.wav,WE HAVE NINE PLAYERS IN OUR TEAM
audio/train_01964.wav,THEY FOUND SEVEN DIFFERENT SPECIES OF BIRDS IN THE PARK
audio/train_01965.wav,HE HAS EIGHT SIBLINGS AND HE IS THE ELDEST
audio/train_01966.wav,THE CHEF USED EIGHT DIFFERENT SPICES TO CREATE THAT DISH
audio/train_01967.wav,THE BOOK IS DIVIDED INTO TWO PARTS
audio/train_01968.wav,SHE HAD SIX DIFFERENT MUSICAL INSTRUMENTS TO PLAY WITH
audio/train_01969.wav,THEY WAITED FOR THREE HOURS IN THE QUEUE TO GET TICKETS FOR THE CONCERT
audio/train_01970.wav,THEY DONATED FIVE PERCENT OF THEIR EARNINGS TO A LOCAL CHARITY EVERY MONTH
audio/train_01971.wav,THEY WAITED IN LINE FOR FIVE HOURS TO GET TICKETS TO THE CONCERT
audio/train_01972.wav,HE NEEDED TWO MORE POINTS TO WIN THE GAME
audio/train_01973.wav,THE PLANT HAD GROWN FOUR INCHES SINCE SHE LAST MEASURED IT
audio/train_01974.wav,THEY WERE ABLE TO SOLVE THE PUZZLE IN JUST SEVEN MOVES
audio/train_01975.wav,THEY WERE ABLE TO COMPLETE THE MARATHON IN JUST SEVEN HOURS
audio/train_01976.wav,THEY DONATED FIVE PERCENT OF THEIR EARNINGS TO A LOCAL CHARITY EVERY MONTH
audio/train_01977.wav,HE HAD TO TAKE SIX DIFFERENT MEDICATIONS TO MANAGE HIS CONDITION
audio/train_01978.wav,THEY HAD TO CLIMB FOUR FLIGHTS OF STAIRS TO REACH THE TOP
audio/train_01979.wav,THE TEAM WENT ON A TWO DAY RETREAT TO PITCH A TENT
audio/train_01980.wav,SHE HAD SIX DIFFERENT JOBS BEFORE FINDING HER DREAM JOB
audio/train_01981.wav,WE DROVE FOR FIVE HOURS STRAIGHT TO GET TO OUR DESTINATION
audio/train_01982.wav,WE HAD ZERO CLUES ABOUT THE SURPRISE PARTY THAT WAS PLANNED FOR US
audio/train_01983.wav,HE WORKED FOR NINE DIFFERENT COMPANIES IN HIS CAREER
audio/train_01984.wav,THE CHEF USED EIGHT DIFFERENT SPICES TO CREATE THAT DISH
audio/train_01985.wav,SHE RECEIVED NINE BIRTHDAY CARDS IN THE MAIL
audio/train_01986.wav,THEY TOOK A TWO HOUR TRAIN RIDE TO GET TO THE BEACH
audio/train_01987.wav,THEY DECIDED TO CUT OUT ALL PROCESSED FOODS AND EAT A ZERO ADDITIVE DIET
audio/train_01988.wav,HE IS ONE OF THE MOST INSPIRING TEACHERS IN THE SCHOOL
audio/train_01989.wav,THEY TOOK A TWO HOUR TRAIN RIDE TO GET TO THE BEACH
audio/train_01990.wav,THE BOOK IS DIVIDED INTO FIVE CHAPTERS EACH WITH A DIFFERENT THEME
audio/train_01991.wav,THEY WATCHED TWO MOVIES BACK TO BACK LAST NIGHT
audio/train_01992.wav,WE SAW NINE DIFFERENT SPECIES OF BIRDS DURING OUR HIKE
audio/train_01993.wav,HE WORKED FOR NINE DIFFERENT COMPANIES IN HIS CAREER
audio/train_01994.wav,THERE CAN ONLY BE ONE WINNER FOR THE CONTEST
audio/train_01995.wav,SHE GAVE THREE REASONS WHY SHE DID NOT WANT TO GO TO THE PARTY
audio/train_01996.wav,THEY WERE SEVEN MILES INTO THEIR HIKE
audio/train_01997.wav,THEY HAD TO SOLVE SEVEN RIDDLES TO ENTER THE CASTLE
audio/train_01998.wav,THEY HAD TO MAKE EIGHT DIFFERENT STOPS ON THEIR ROAD TRIP
audio/train_01999.wav,THEY SAW EIGHT SHOOTING STARS DURING THEIR CAMPING TRIP
audio/train_02000.wav,THE TEAM WAS SPLIT INTO TWO GROUPS FOR THE CHALLENGE
audio/train_02001.wav,THE MOVIE HAD A SEVEN MINUTE LONG ACTION SEQUENCE
audio/train_02002.wav,HAD TO DRIVE SIX HOURS TO ATTEND A FAMILY REUNION
audio/train_02003.wav,THEY HAD ZERO TOLERANCE FOR BULLYING IN THEIR SCHOOL
audio/train_02004.wav,THE PAINTING WAS DIVIDED INTO THREE PANELS
audio/train_02005.wav,THEY PLANTED SIX APPLE TREES IN THEIR GARDEN
audio/train_02006.wav,THEY WERE ABLE TO RUN SEVEN MILES WITHOUT STOPPING
audio/train_02007.wav,SHE DONATED NINE BAGS OF CLOTHES TO CHARITY
audio/train_02008.wav,THE GAME HAD THREE LEVELS OF DIFFICULTY
audio/train_02009.wav,THE TEAM WAS SPLIT INTO TWO GROUPS FOR THE CHALLENGE
audio/train_02010.wav,IT TOOK ONE MINUTE FOR THE TEAM TO MAKE THEIR DECISION
audio/train_02011.wav,THEY WAITED FOR THREE HOURS IN THE QUEUE TO GET TICKETS FOR THE CONCERT
audio/train_02012.wav,ONE CANNOT ACHIEVE GREATNESS WITHOUT HARD WORK AND DEDICATION
audio/train_02013.wav,THEY TOOK FIVE PHOTOGRAPHS OF THE SUNSET
audio/train_02014.wav,THEY WERE SEVEN PAGES INTO THE BOOK
audio/train_02015.wav,THE PAINTING WAS DIVIDED INTO THREE PANELS
audio/train_02016.wav,WE PLANTED NINE ROWS OF VEGETABLES IN THE GARDEN
audio/train_02017.wav,HE WAS ABLE TO COMPLETE THE CROSSWORD PUZZLE WITH ZERO ERRORS
audio/train_02018.wav,THEY WERE LUCKY TO ESCAPE THE BUILDING WITH ZERO INJURIES
audio/train_02019.wav,SHE WAS SIX YEARS OLD WHEN SHE LEARNT HOW TO RIDE A BICYCLE
audio/train_02020.wav,HE NEEDED TWO MORE POINTS TO WIN THE GAME
audio/train_02021.wav,HE RECEIVED SIX NAME CARDS IN THE COMPANY EVENT TODAY
audio/train_02022.wav,HE COOKED SIX DIFFERENT DISHES FOR HIS DINNER PARTY
audio/train_02023.wav,SHE ONLY HAD FOUR DAYS TO FINISH THE PROJECT
audio/train_02024.wav,THEY TOOK A NINE HOUR FLIGHT TO GET TO LONDON
audio/train_02025.wav,HE ALWAYS BELIEVED THAT ONE DAY HE WOULD MAKE A DIFFERENCE IN THE WORLD
audio/train_02026.wav,THEY TOOK FIVE PHOTOGRAPHS OF THE SUNSET
audio/train_02027.wav,THEY FOUND FIVE DIFFERENT SPECIES OF BIRDS IN THE FOREST
audio/train_02028.wav,THEY STAYED IN ROOM NINE AT THAT HOTEL
audio/train_02029.wav,HE HAD FOUR SIBLINGS WHICH ARE ALL OLDER THAN HIM
audio/train_02030.wav,THE ARTIST HAD BEEN WORKING ON THE PAINTING FOR EIGHT MONTHS
audio/train_02031.wav,THEY HAD TO CROSS FOUR RIVERS TO GET TO THE OTHER SIDE
audio/train_02032.wav,THEY STAYED IN ROOM NINE AT THAT HOTEL
audio/train_02033.wav,THE FIVE FRIENDS WENT ON A ROAD TRIP ACROSS THE COUNTRY
audio/train_02034.wav,HE IS ONE OF THE MOST INSPIRING TEACHERS IN THE SCHOOL
audio/train_02035.wav,WE HAVE NINE DAYS UNTIL THE DEADLINE
audio/train_02036.wav,WE WERE GIVEN TWO OPTIONS TO CHOOSE FROM
audio/train_02037.wav,THEY FOUND A NINE LETTER WORD IN THE CROSSWORD PUZZLE
audio/train_02038.wav,SHE SCORED NINE FOR THE QUIZ
audio/train_02039.wav,SHE NEEDS TO TAKE TWO PILLS EVERY MORNING FOR HER HEALTH
audio/train_02040.wav,WE HAD TO WALK FIVE MILES TO GET TO THE NEAREST TOWN
audio/train_02041.wav,THEY TOOK FIVE PHOTOGRAPHS OF THE SUNSET
audio/train_02042.wav,HE HAS NINE SIBLINGS
audio/train_02043.wav,THEY HAD TO CLIMB FIVE FLIGHTS OF STAIRS TO GET TO THEIR APARTMENT
audio/train_02044.wav,HE HAD TO SOLVE THREE MATH PROBLEMS TO PASS THE TEST
audio/train_02045.wav,THE HOTEL ROOM HAS FOUR PILLOWS ON EACH BED
audio/train_02046.wav,THEY FOUND ZERO ERRORS IN OUR CALCULATIONS
audio/train_02047.wav,CAR HAD FOUR FLAT TIRES
audio/train_02048.wav,HE NEEDED TWO MORE POINTS TO WIN THE GAME
audio/train_02049.wav,SHE IS ONE OF THE MOST DETERMINED ATHLETES
audio/train_02050.wav,SHE FELT ZERO ANXIETY WHEN SPEAKING IN FRONT OF LARGE AUDIENCES
audio/train_02051.wav,SHE NEEDS TO TAKE TWO PILLS EVERY MORNING FOR HER HEALTH
audio/train_02052.wav,THEY HAVE BEEN MARRIED FOR NINE YEARS
audio/train_02053.wav,SHE IS THE ONLY ONE WHO UNDERSTANDS THE SITUATION
audio/train_02054.wav,WE HAVE NINE DAYS UNTIL THE DEADLINE
audio/train_02055.wav,JOHN HAS FIVE SIBLINGS AND ALL THEM ARE YOUNGER THAN HIM
audio/train_02056.wav,SHE HAD TO WRITE SIX DIFFERENT ESSAYS FOR HER COLLEGE APPLICATIONS
audio/train_02057.wav,THEY SAW EIGHT SHOOTING STARS DURING THEIR CAMPING TRIP
audio/train_02058.wav,SHE WAS ABLE TO COMPLETE THE PUZZLE WITH ZERO HELP FROM HER FRIENDS
audio/train_02059.wav,SHE RECEIVED FIVE DIFFERENT JOB OFFERS AFTER GRADUATING FROM COLLEGE
audio/train_02060.wav,SHE CAN TAKE SIX DIFFERENT BUSES TO GET TO HER OFFICE
audio/train_02061.wav,THERE IS A ONE DOLLAR DISCOUNT FOR BUS PASSES TODAY
audio/train_02062.wav,THEY HAD TO CLIMB EIGHT FLIGHTS OF STAIRS TO GET TO THEIR APARTMENT
audio/train_02063.wav,WE ONLY NEED ONE MORE PERSON TO COMPLETE THE TEAM
audio/train_02064.wav,HE WROTE A BOOK WITH NINE CHAPTERS
audio/train_02065.wav,THEY HAD SEVEN GUESTS AT THE DINNER PARTY
audio/train_02066.wav,SHE HAD TO ANSWER FOUR INTERVIEW QUESTIONS TO GET THE JOB
audio/train_02067.wav,THE TRAIN HAD FOUR STOPS BEFORE REACHING ITS DESTINATION
audio/train_02068.wav,WE NEED TO LEAVE FOR THE TRAIN STATION IN FOUR HOURS
audio/train_02069.wav,THEY HAD TO SOLVE SEVEN RIDDLES TO ENTER THE CASTLE
audio/train_02070.wav,WE ONLY NEED ONE MORE PERSON TO COMPLETE THE TEAM
audio/train_02071.wav,THEY READ SEVEN BOOKS OVER THE SUMMER AND FELT PROUD OF THEIR ACCOMPLISHMENT
audio/train_02072.wav,THE PAINTING FEATURED THREE BOATS ON A CALM BLUE SEA
audio/train_02073.wav,SHE HAD TO WRITE SIX DIFFERENT ESSAYS FOR HER COLLEGE APPLICATIONS
audio/train_02074.wav,HE HAD TO CHOOSE BETWEEN TWO JOB OFFERS
audio/train_02075.wav,HE WAS ABLE TO FIX THE CAR WITH ZERO KNOWLEDGE OF MECHANICS
audio/train_02076.wav,THE BUS ARRIVES EVERY TWO HOURS AT THIS STATION
audio/train_02077.wav,THE MAGAZINE HAD FOUR ARTICLES ON DIFFERENT TOPICS
audio/train_02078.wav,THE PLANT HAD GROWN FOUR INCHES SINCE SHE LAST MEASURED IT
audio/train_02079.wav,STAYED IN ROOM NINE AT THAT HOTEL
audio/train_02080.wav,SHE RECEIVED FIVE REJECTION LETTERS BEFORE FINALLY LANDING HER DREAM JOB
audio/train_02081.wav,HE HAD TO GIVE A SPEECH IN FRONT OF FIVE HUNDRED PEOPLE
audio/train_02082.wav,THEY WATCHED TWO MOVIES BACK TO BACK LAST NIGHT
audio/train_02083.wav,SHE RECEIVED NINE BIRTHDAY CARDS IN THE MAIL
audio/train_02084.wav,THE COMPANY HAD BEEN IN BUSINESS FOR FOUR DECADES
audio/train_02085.wav,THEY TOOK A TWO HOUR TRAIN RIDE TO GET TO THE BEACH
audio/train_02086.wav,THE PLANT NEEDED TO BE WATERED EVERY THREE DAYS
audio/train_02087.wav,HE WAS ABLE TO FIX THE LEAK IN THE ROOF WITH ZERO ISSUES
audio/train_02088.wav,THE RECIPE CALLS FOR FIVE CUPS OF FLOUR
audio/train_02089.wav,HAD TO ANSWER FOUR INTERVIEW QUESTIONS TO GET THE JOB
