path,annotation
audio/train_00696.wav,HE HAD ZERO PATIENCE FOR PEOPLE WHO WERE INCOMPETENT AT THEIR JOBS
audio/train_00697.wav,THE MAGNIFICENT SEVEN IS A CLASSIC WESTERN MOVIE
audio/train_00698.wav,HE HAD SIX DIFFERENT CARS THROUGHOUT HIS LIFE
audio/train_00699.wav,THEY DONATED FIVE PERCENT OF THEIR EARNINGS TO A LOCAL CHARITY EVERY MONTH
audio/train_00700.wav,THEY WERE ONLY EIGHT PAGES AWAY FROM FINISHING THE BOOK
audio/train_00701.wav,THEY FOUND FIVE DIFFERENT SPECIES OF BIRDS IN THE FOREST
audio/train_00702.wav,HE HAD TO CHOOSE BETWEEN TWO JOB OFFERS
audio/train_00703.wav,HE HAS NINE SIBLINGS
audio/train_00704.wav,THEY SAY THAT FIVE IS THE MAGIC NUMBER
audio/train_00705.wav,HAD TO TAKE FIVE DIFFERENT MEDICATIONS TO MANAGE HER CHRONIC ILLNESS
audio/train_00706.wav,THEY HAD TO SOLVE SEVEN RIDDLES TO ENTER THE CASTLE
audio/train_00707.wav,WERE ABLE TO COMPLETE THE MARATHON IN JUST SEVEN HOURS
audio/train_00708.wav,SHE TOOK ONE LAST LOOK AT THE SUNSET BEFORE HEADING HOME
audio/train_00709.wav,THE TEAM WON THEIR EIGHTH CONSECUTIVE GAME THIS SEASON
audio/train_00710.wav,THEY ONLY HAD THREE DAYS TO PACK FOR THEIR VACATION TO THE BEACH
audio/train_00711.wav,THERE ARE FOUR SEASONS IN A YEAR
audio/train_00712.wav,THEY SAY THAT FIVE IS THE MAGIC NUMBER
audio/train_00713.wav,THE PLANT HAD GROWN FOUR INCHES SINCE SHE LAST MEASURED IT
audio/train_00714.wav,HE WAS SURPRISED TO FIND ZERO ERRORS IN HIS CODE AFTER WORKING ON IT ALL NIGHT
audio/train_00715.wav,SHE HAD TO GET UP AT EIGHT EVERY MORNING TO CATCH THE BUS TO WORK
audio/train_00716.wav,THEY DIVIDED THE CAKE INTO TWO EQUAL PORTIONS
audio/train_00717.wav,HE WAS ABLE TO FIX THE LEAK IN THE ROOF WITH ZERO ISSUES
audio/train_00718.wav,THE CAR HAD FOUR FLAT TIRES
audio/train_00719.wav,THEY STAYED IN SIX DIFFERENT HOTELS DURING THEIR ROAD TRIP
audio/train_00720.wav,SHE WON SIX AWARDS FOR HER ARTWORK
audio/train_00721.wav,THEY WERE ONLY EIGHT POUNDS AWAY FROM THEIR GOAL WEIGHT
audio/train_00722.wav,THEY HAD TO CLIMB FIVE FLIGHTS OF STAIRS TO GET TO THEIR APARTMENT
audio/train_00723.wav,THEY STAYED IN THE HOTEL ROOM FOR SEVEN NIGHTS
audio/train_00724.wav,THEY WERE ONLY EIGHT PAGES AWAY FROM FINISHING THE BOOK
audio/train_00725.wav,HE PLAYED NINE DIFFERENT MUSICAL INSTRUMENTS
audio/train_00726.wav,SHE HAD SIX DIFFERENT JOBS BEFORE FINDING HER DREAM JOB
audio/train_00727.wav,THEY CAUGHT SIX FISH IN THE RIVER
audio/train_00728.wav,WE NEED TO LEAVE FOR THE TRAIN STATION IN FOUR HOURS
audio/train_00729.wav,THE STORE WAS OPEN SEVEN DAYS A WEEK
audio/train_00730.wav,THE BOOK IS DIVIDED INTO TWO PARTS
audio/train_00731.wav,THE COMPANY HAD BEEN IN BUSINESS FOR FOUR DECADES
audio/train_00732.wav,HE ALWAYS BELIEVED THAT ONE DAY HE WOULD MAKE A DIFFERENCE IN THE WORLD
audio/train_00733.wav,THE BOOK WAS DIVIDED INTO THREE PARTS
audio/train_00734.wav,WE HAVE NINE PLAYERS IN OUR TEAM
audio/train_00735.wav,THEY STAYED IN THE HOTEL ROOM FOR SEVEN NIGHTS
audio/train_00736.wav,THEY PLANTED SIX APPLE TREES IN THEIR GARDEN
audio/train_00737.wav,SHE IS ONE OF THE MOST DETERMINED ATHLETES
audio/train_00738.wav,SHE HAD TO VISIT FOUR DIFFERENT COUNTRIES TO COMPLETE HER BUCKET LIST
audio/train_00739.wav,HE HAD ZERO PATIENCE FOR PEOPLE WHO WERE INCOMPETENT AT THEIR JOBS
audio/train_00740.wav,THEY WERE ABLE TO RUN SEVEN MILES WITHOUT STOPPING
audio/train_00741.wav,THE PAINTING WAS DIVIDED INTO THREE PANELS
audio/train_00742.wav,THEY CAUGHT SIX FISH IN THE RIVER
audio/train_00743.wav,HE IS THE ONLY ONE WHO CAN SOLVE THE PUZZLE
audio/train_00744.wav,WE HAD TO WALK FIVE MILES TO GET TO THE NEAREST TOWN
audio/train_00745.wav,THERE IS ONLY ONE WAY TO SUCCESS AND THAT IS HARD WORK AND DETERMINATION
audio/train_00746.wav,THERE ARE TWO DOORS TO ENTER THE BUILDING
audio/train_00747.wav,HE HAD FOUR SIBLINGS WHICH ARE ALL OLDER THAN HIM
audio/train_00748.wav,SHE HAD EIGHT DIFFERENT OUTFITS FOR THE PHOTOSHOOT
audio/train_00749.wav,THEY WERE ABLE TO SOLVE THREE PUZZLES
audio/train_00750.wav,SHE GAVE THREE REASONS WHY SHE DID NOT WANT TO GO TO THE PARTY
audio/train_00751.wav,THEY DECIDED TO START THEIR OWN BUSINESS WITH ZERO INVESTMENT CAPITAL
audio/train_00752.wav,THEY WERE ABLE TO CATCH SEVEN FISH IN THE LAKE
audio/train_00753.wav,WE COUNTED TO NINE BEFORE STARTING THE GAME
audio/train_00754.wav,HE COOKED SIX DIFFERENT DISHES FOR HIS DINNER PARTY
audio/train_00755.wav,SHE WAS EIGHT YEARS OLD WHEN SHE FIRST DISCOVERED HER LOVE FOR MUSIC
audio/train_00756.wav,SHE IS THE ONLY ONE WHO UNDERSTANDS THE SITUATION
audio/train_00757.wav,THEY HAD TO CROSS FOUR RIVERS TO GET TO THE OTHER SIDE
audio/train_00758.wav,HAD TO WALK THREE MILES TO GET TO THE NEAREST STORE
audio/train_00759.wav,IT TOOK THEM EIGHT ATTEMPTS TO FINALLY SOLVE THE COMPLEX PUZZLE
audio/train_00760.wav,HE WAS SHOCKED TO FIND OUT THAT HE HAD ZERO DOLLARS LEFT IN HIS BANK ACCOUNT
audio/train_00761.wav,HE WROTE EIGHT DIFFERENT DRAFTS OF HIS NOVEL
audio/train_00762.wav,SHE HAD TO VISIT THREE DIFFERENT STORES TO FIND THE PERFECT DRESS
audio/train_00763.wav,SHE HAD TO WAIT FOR THREE HOURS AT THE AIRPORT DUE TO A DELAYED FLIGHT
audio/train_00764.wav,WE HAVE TO BE AT THE MEETING BY NINE TOMORROW
audio/train_00765.wav,HE WAS ABLE TO FIX THE LEAK IN THE ROOF WITH ZERO ISSUES
audio/train_00766.wav,HE ORDERED SIX PIZZAS FOR THE PARTY
audio/train_00767.wav,SHE VISITED NINE COUNTRIES IN A YEAR
audio/train_00768.wav,SHE HAD TO WEAR FOUR LAYERS OF CLOTHING TO STAY WARM IN THE WINTER
audio/train_00769.wav,HE WAS ABLE TO COMPLETE THE MARATHON IN JUST TWO HOURS
audio/train_00770.wav,THEY WERE ABLE TO RUN SEVEN MILES WITHOUT STOPPING
audio/train_00771.wav,THE TEAM HAD ZERO CHANCE OF WINNING THE GAME
audio/train_00772.wav,THE PROJECT WILL TAKE TWO MONTHS TO COMPLETE
audio/train_00773.wav,SHE NEEDS TO TAKE TWO PILLS EVERY MORNING FOR HER HEALTH
audio/train_00774.wav,BOTH OF THEM HAVE TWO OLDER SIBLINGS
audio/train_00775.wav,THERE ARE FOUR SEASONS IN A YEAR
audio/train_00776.wav,THEY READ SEVEN BOOKS OVER THE SUMMER AND FELT PROUD OF THEIR ACCOMPLISHMENT
audio/train_00777.wav,HE DIVIDED THE PIE INTO FOUR EQUAL PIECES
audio/train_00778.wav,THERE CAN ONLY BE ONE WINNER FOR THE CONTEST
audio/train_00779.wav,THEY WERE ONLY EIGHT POUNDS AWAY FROM THEIR GOAL WEIGHT
audio/train_00780.wav,SHE HAD TO READ FOUR BOOKS FOR HER ENGLISH CLASS
audio/train_00781.wav,HE WAS ABLE TO COMPLETE THE CROSSWORD PUZZLE WITH ZERO ERRORS
audio/train_00782.wav,THEY DECIDED TO CUT OUT ALL PROCESSED FOODS AND EAT A ZERO ADDITIVE DIET
audio/train_00783.wav,HE HAD TO GIVE A PRESENTATION TO A GROUP OF SIX EXECUTIVES
audio/train_00784.wav,THEY WERE ONLY EIGHT SECONDS AWAY FROM BEATING THE WORLD RECORD
audio/train_00785.wav,THE RECIPE CALLS FOR FOUR CUPS OF FLOUR
audio/train_00786.wav,THEY WAITED FOR THREE HOURS IN THE QUEUE TO GET TICKETS FOR THE CONCERT
audio/train_00787.wav,THEY SPENT SIX MONTHS RENOVATING THEIR HOUSE
audio/train_00788.wav,WE WERE GIVEN TWO OPTIONS TO CHOOSE FROM
audio/train_00789.wav,THEY NEEDED TO ORDER TWO MORE BOXES OF PAPER FOR THE OFFICE
audio/train_00790.wav,HE WAS SHOCKED TO FIND OUT THAT HE HAD ZERO DOLLARS LEFT IN HIS BANK ACCOUNT
audio/train_00791.wav,THE BOOK IS DIVIDED INTO FIVE CHAPTERS EACH WITH A DIFFERENT THEME
audio/train_00792.wav,HE ONLY HAD FOUR DAYS TO FINISH THE PROJECT
audio/train_00793.wav,THEY WERE ABLE TO FIND THE TWO SOCKS THAT HAD GONE MISSING
audio/train_00794.wav,THERE ARE SEVEN DAYS IN A WEEK
audio/train_00795.wav,THE LIBRARY HAD EIGHT STUDY ROOMS
audio/train_00796.wav,THE GAME HAD THREE LEVELS OF DIFFICULTY
audio/train_00797.wav,THEY HAVE BEEN MARRIED FOR NINE YEARS
audio/train_00798.wav,WE HAVE NINE PLAYERS IN OUR TEAM
audio/train_00799.wav,SHE FELT ZERO ANXIETY WHEN SPEAKING IN FRONT OF LARGE AUDIENCES
audio/train_00800.wav,HE WAS ABLE TO LIFT A HEAVY WEIGHT WITH ZERO STRAIN ON HIS BACK
audio/train_00801.wav,THEY TOOK FIVE PHOTOGRAPHS OF THE SUNSET
audio/train_00802.wav,THEY WERE ABLE TO ESCAPE THE ROOM WITH ZERO MINUTES TO SPARE
audio/train_00803.wav,WE ONLY HAVE ONE LIFE TO LIVE SO MAKE IT COUNT
audio/train_00804.wav,THEY WAITED IN LINE FOR FIVE HOURS TO GET TICKETS TO THE CONCERT
audio/train_00805.wav,THEY PLANTED SIX APPLE TREES IN THEIR GARDEN
audio/train_00806.wav,SAW TWO DOLPHINS SWIMMING IN THE OCEAN THIS MORNING
audio/train_00807.wav,THEY WERE ABLE TO RUN SEVEN MILES WITHOUT STOPPING
audio/train_00808.wav,SHE HAD TO TAKE FIVE DIFFERENT MEDICATIONS TO MANAGE HER CHRONIC ILLNESS
audio/train_00809.wav,HE WAS THE ONE WHO TAUGHT ME HOW TO RIDE A BIKE
audio/train_00810.wav,THEY HAD TO SOLVE SEVEN RIDDLES TO ENTER THE CASTLE
audio/train_00811.wav,HE PLAYED NINE DIFFERENT MUSICAL INSTRUMENTS
audio/train_00812.wav,BOTH OF THEM HAVE TWO OLDER SIBLINGS
audio/train_00813.wav,THEY HAD ZERO TOLERANCE FOR BULLYING IN THEIR SCHOOL
audio/train_00814.wav,THEY SPENT EIGHT HOURS DRIVING ACROSS THE COUNTRY
audio/train_00815.wav,THE BOOK WAS DIVIDED INTO THREE PARTS
audio/train_00816.wav,BOTH OF THEM HAVE TWO OLDER SIBLINGS
audio/train_00817.wav,HE PLAYED NINE DIFFERENT MUSICAL INSTRUMENTS
audio/train_00818.wav,HE WAS ABLE TO LIFT A HEAVY WEIGHT WITH ZERO STRAIN ON HIS BACK
audio/train_00819.wav,THEY NEEDED THREE MORE PLAYERS TO FORM A FULL TEAM
audio/train_00820.wav,SHE CAN SPEAK NINE LANGUAGES FLUENTLY
audio/train_00821.wav,HE HAD SIX DIFFERENT CARS THROUGHOUT HIS LIFE
audio/train_00822.wav,THE SEVEN WONDERS OF THE ANCIENT WORLD ARE AMAZING
audio/train_00823.wav,THE PLANT HAD GROWN FOUR INCHES SINCE SHE LAST MEASURED IT
audio/train_00824.wav,SHE BOUGHT A SET OF FIVE CANDLES WITH DIFFERENT SCENTS
audio/train_00825.wav,HE WAS ABLE TO FIX THE CAR WITH ZERO KNOWLEDGE OF MECHANICS
audio/train_00826.wav,SHE RECEIVED FIVE DIFFERENT JOB OFFERS AFTER GRADUATING FROM COLLEGE
audio/train_00827.wav,THEY HAD TO DRIVE SIX HOURS TO ATTEND A FAMILY REUNION
audio/train_00828.wav,THEY SAY ONE SHOULD ALWAYS FOLLOW THEIR DREAMS
audio/train_00829.wav,THE FIVE FRIENDS WENT ON A ROAD TRIP ACROSS THE COUNTRY
audio/train_00830.wav,WE ONLY HAVE ONE LIFE TO LIVE SO MAKE IT COUNT
audio/train_00831.wav,HE WON SEVEN GAMES IN A ROW AND FELT UNSTOPPABLE
audio/train_00832.wav,HE IS THE ONLY ONE WHO CAN SOLVE THE PUZZLE
audio/train_00833.wav,RECEIVED FIVE DIFFERENT JOB OFFERS AFTER GRADUATING FROM COLLEGE
audio/train_00834.wav,THEY WERE ABLE TO CATCH SEVEN FISH IN THE LAKE
audio/train_00835.wav,BOTH OF THEM HAVE TWO OLDER SIBLINGS
audio/train_00836.wav,THEY SPENT SIX MONTHS RENOVATING THEIR HOUSE
audio/train_00837.wav,THEY WENT ON A SIX DAY HIKE THROUGH THE MOUNTAINS
audio/train_00838.wav,WE ONLY HAVE ONE LIFE TO LIVE SO MAKE IT COUNT
audio/train_00839.wav,THEY SAY THAT FIVE IS THE MAGIC NUMBER
audio/train_00840.wav,SHE ONLY HAD FIVE MINUTES TO FINISH THE EXAM
audio/train_00841.wav,THEY WERE ONLY SEVEN DOLLARS AWAY FROM BEING ABLE TO AFFORD THE NEW GADGET
audio/train_00842.wav,THE MOVIE HAD A SEVEN MINUTE LONG ACTION SEQUENCE
audio/train_00843.wav,THEY TOOK A TWO HOUR TRAIN RIDE TO GET TO THE BEACH
audio/train_00844.wav,HE HAD TO PAY FOUR TIMES THE NORMAL PRICE FOR THE CONCERT TICKETS
audio/train_00845.wav,SHE NEEDS TO TAKE TWO PILLS EVERY MORNING FOR HER HEALTH
audio/train_00846.wav,THEY WAITED IN LINE FOR FIVE HOURS TO GET TICKETS TO THE CONCERT
audio/train_00847.wav,SHE WAS EIGHT YEARS OLD WHEN SHE FIRST DISCOVERED HER LOVE FOR MUSIC
audio/train_00848.wav,HE CAUGHT EIGHT FISH ON THEIR FISHING TRIP
audio/train_00849.wav,SHE WROTE A FIVE PAGE ESSAY ON THE IMPACT OF CLIMATE CHANGE ON MARINE LIFE
audio/train_00850.wav,THEY READ SEVEN BOOKS OVER THE SUMMER AND FELT PROUD OF THEIR ACCOMPLISHMENT
audio/train_00851.wav,THEY TOOK A TWO HOUR TRAIN RIDE TO GET TO THE BEACH
audio/train_00852.wav,THE PROJECT WILL TAKE TWO MONTHS TO COMPLETE
audio/train_00853.wav,SHE WON NINE MATCHES IN A ROW
audio/train_00854.wav,THE SEVEN DWARFS IN SNOW WHITE ARE ICONIC CHARACTERS
audio/train_00855.wav,SHE COULD ONLY AFFORD TO BUY FOUR ITEMS FROM THE STORE
audio/train_00856.wav,SHE DECIDED TO GO ON A ZERO SUGAR DIET TO IMPROVE HER HEALTH
audio/train_00857.wav,THEY STAYED IN SIX DIFFERENT HOTELS DURING THEIR ROAD TRIP
audio/train_00858.wav,THERE IS A ONE DOLLAR DISCOUNT FOR BUS PASSES TODAY
audio/train_00859.wav,THE RECIPE REQUIRES TWO CUPS OF FLOUR
audio/train_00860.wav,SHE BOUGHT THREE NEW DRESSES FOR THE WEDDING
audio/train_00861.wav,SHE NEEDS TO TAKE TWO PILLS EVERY MORNING FOR HER HEALTH
audio/train_00862.wav,SHE HAD TO TAKE FIVE DIFFERENT MEDICATIONS TO MANAGE HER CHRONIC ILLNESS
audio/train_00863.wav,THEY HAD TO ATTEND THREE DIFFERENT WEDDINGS IN THE SAME MONTH
audio/train_00864.wav,IT TOOK ONE MINUTE FOR THE TEAM TO MAKE THEIR DECISION
audio/train_00865.wav,HE HAD SIX DIFFERENT MUSICAL INSTRUMENTS TO PLAY WITH
audio/train_00866.wav,THEY SAY THAT FIVE IS THE MAGIC NUMBER
audio/train_00867.wav,SHE SPENT TWO HOURS CLEANING HER APARTMENT
audio/train_00868.wav,THEY WERE SEVEN MILES INTO THEIR HIKE
audio/train_00869.wav,SHE VISITED NINE COUNTRIES IN A YEAR
audio/train_00870.wav,SHE COULD ONLY AFFORD TO BUY FOUR ITEMS FROM THE STORE
audio/train_00871.wav,THEY ONLY HAD THREE MINUTES TO COMPLETE THE OBSTACLE COURSE
audio/train_00872.wav,HE HAD TO CHOOSE BETWEEN TWO JOB OFFERS
audio/train_00873.wav,THE PAINTING FEATURED THREE BOATS ON A CALM BLUE SEA
audio/train_00874.wav,HE WAS THE ONE WHO TAUGHT ME HOW TO RIDE A BIKE
audio/train_00875.wav,SHE HAD EIGHT DIFFERENT OUTFITS FOR THE PHOTOSHOOT
audio/train_00876.wav,SHE HAD TO WORK EIGHT HOUR SHIFTS AT THE HOSPITAL
audio/train_00877.wav,AFTER THREE HOURS OF DRIVING THEY FINALLY ARRIVED AT THEIR DESTINATION
audio/train_00878.wav,THEY WERE SEVEN PAGES INTO THE BOOK
audio/train_00879.wav,HE WAS ABLE TO COMPLETE THE CROSSWORD PUZZLE WITH ZERO ERRORS
audio/train_00880.wav,THERE ARE TWO DOORS TO ENTER THE BUILDING
audio/train_00881.wav,THEY READ SEVEN BOOKS OVER THE SUMMER AND FELT PROUD OF THEIR ACCOMPLISHMENT
audio/train_00882.wav,HE WAS ABLE TO LIFT A HEAVY WEIGHT WITH ZERO STRAIN ON HIS BACK
audio/train_00883.wav,HE HAD TO GIVE A SPEECH IN FRONT OF FIVE HUNDRED PEOPLE
audio/train_00884.wav,THEY NEEDED TO ORDER TWO MORE BOXES OF PAPER FOR THE OFFICE
audio/train_00885.wav,THEY DECIDED TO CUT OUT ALL PROCESSED FOODS AND EAT A ZERO ADDITIVE DIET
audio/train_00886.wav,THE SEVEN WONDERS OF THE ANCIENT WORLD ARE AMAZING
audio/train_00887.wav,THEY WERE ONLY EIGHT SECONDS AWAY FROM BEATING THE WORLD RECORD
audio/train_00888.wav,WE SHOULD MAKE THE MOST OF IT AS WE ONLY HAVE ONE LIFE TO LIVE
audio/train_00889.wav,THEY STAYED IN SIX DIFFERENT HOTELS DURING THEIR ROAD TRIP
audio/train_00890.wav,THE TEAM HAD ZERO CHANCE OF WINNING THE GAME
audio/train_00891.wav,THEY SAY THAT ONE SHOULD ALWAYS TREAT OTHERS WITH RESPECT
audio/train_00892.wav,SHE RECEIVED FIVE REJECTION LETTERS BEFORE FINALLY LANDING HER DREAM JOB
audio/train_00893.wav,WE DROVE FOR FIVE HOURS STRAIGHT TO GET TO OUR DESTINATION
audio/train_00894.wav,HE IS ONE OF THE MOST INSPIRING TEACHERS IN THE SCHOOL
audio/train_00895.wav,HE PLAYED NINE DIFFERENT MUSICAL INSTRUMENTS
audio/train_00896.wav,THEY HAD SEVEN GUESTS AT THE DINNER PARTY
audio/train_00897.wav,DURING THEIR FASTING PERIOD ZERO CALORIES WERE CONSUMED
audio/train_00898.wav,THE PLANT NEEDED TO BE WATERED EVERY THREE DAYS
audio/train_00899.wav,HE WAS THE ONE WHO TAUGHT ME HOW TO RIDE A BIKE
audio/train_00900.wav,THE FIVE FRIENDS WENT ON A ROAD TRIP ACROSS THE COUNTRY
audio/train_00901.wav,SHE IS THE ONLY ONE WHO UNDERSTANDS THE SITUATION
audio/train_00902.wav,THEY HAD EIGHT DIFFERENT VARIETIES OF CHEESE ON THE TABLE
audio/train_00903.wav,SHE HAD EIGHT DIFFERENT OUTFITS FOR THE PHOTOSHOOT
audio/train_00904.wav,SHE WROTE A FIVE PAGE ESSAY ON THE IMPACT OF CLIMATE CHANGE ON MARINE LIFE
audio/train_00905.wav,SHE BOUGHT A SET OF FIVE CANDLES WITH DIFFERENT SCENTS
audio/train_00906.wav,THE TEAM WAS SPLIT INTO TWO GROUPS FOR THE CHALLENGE
audio/train_00907.wav,HE WAS SHOCKED TO FIND OUT THAT HE HAD ZERO DOLLARS LEFT IN HIS BANK ACCOUNT
audio/train_00908.wav,HE BOUGHT A NINE VOLT BATTERY FOR HIS TORCH LIGHT
audio/train_00909.wav,SHE SPENT TWO HOURS CLEANING HER APARTMENT
audio/train_00910.wav,SHE IS ONE OF THE MOST DETERMINED ATHLETES
audio/train_00911.wav,THERE IS A ONE DOLLAR DISCOUNT FOR BUS PASSES TODAY
audio/train_00912.wav,SHE ATE EIGHT PIECES OF DUMPLINGS AND WAS COMPLETELY STUFFED
audio/train_00913.wav,HE WROTE A BOOK WITH NINE CHAPTERS
audio/train_00914.wav,HE HAD TO PAY FOUR TIMES THE NORMAL PRICE FOR THE CONCERT TICKETS
audio/train_00915.wav,THE PAINTING WAS DIVIDED INTO THREE PANELS
audio/train_00916.wav,SHE SPENT TWO HOURS CLEANING HER APARTMENT
audio/train_00917.wav,THEY HAD TO CLIMB FIVE FLIGHTS OF STAIRS TO GET TO THEIR APARTMENT
audio/train_00918.wav,THE MAGNIFICENT SEVEN IS A CLASSIC WESTERN MOVIE
audio/train_00919.wav,THEY HAD ZERO TOLERANCE FOR BULLYING IN THEIR SCHOOL
audio/train_00920.wav,SHE HAD TO WEAR FOUR LAYERS OF CLOTHING TO STAY WARM IN THE WINTER
audio/train_00921.wav,SPENT SIX WEEKS VOLUNTEERING AT AN ANIMAL SHELTER
audio/train_00922.wav,THERE IS ONLY ONE WAY TO SUCCESS AND THAT IS HARD WORK AND DETERMINATION
audio/train_00923.wav,HE BOUGHT A NINE VOLT BATTERY FOR HIS TORCH LIGHT
audio/train_00924.wav,THEY WERE ABLE TO SOLVE THE PUZZLE IN JUST SEVEN MOVES
audio/train_00925.wav,WAS TORN BETWEEN TWO DIFFERENT CAREER PATHS
audio/train_00926.wav,THE RECIPE CALLS FOR FIVE CUPS OF FLOUR
audio/train_00927.wav,THEY SAY ONE SHOULD ALWAYS FOLLOW THEIR DREAMS
audio/train_00928.wav,HE HAD FOUR SIBLINGS WHICH ARE ALL OLDER THAN HIM
audio/train_00929.wav,THEY TOOK FIVE PHOTOGRAPHS OF THE SUNSET
audio/train_00930.wav,THEY SAY THAT ONE SHOULD ALWAYS TREAT OTHERS WITH RESPECT
audio/train_00931.wav,THERE CAN ONLY BE ONE WINNER FOR THE CONTEST
audio/train_00932.wav,AFTER THREE HOURS OF DRIVING THEY FINALLY ARRIVED AT THEIR DESTINATION
audio/train_00933.wav,THEY HEARD THREE LOUD KNOCKS ON THE DOOR IN THE MIDDLE OF THE NIGHT
audio/train_00934.wav,THE PLANT NEEDED TO BE WATERED EVERY THREE DAYS
audio/train_00935.wav,THEY SAW SEVEN SHOOTING STARS IN ONE NIGHT
audio/train_00936.wav,WE HAVE NINE PLAYERS IN OUR TEAM
audio/train_00937.wav,THEY HAD TO WAIT EIGHT DAYS FOR THEIR PASSPORT TO ARRIVE
audio/train_00938.wav,THEY WERE ABLE TO RUN SEVEN MILES WITHOUT STOPPING
audio/train_00939.wav,THE BOOK HAS TWO DIFFERENT ENDINGS
audio/train_00940.wav,THEY WERE ABLE TO ESCAPE THE ROOM WITH ZERO MINUTES TO SPARE
audio/train_00941.wav,WE HAVE TO BE AT THE MEETING BY NINE TOMORROW
audio/train_00942.wav,THEY TOOK A NINE HOUR FLIGHT TO GET TO LONDON
audio/train_00943.wav,THEY DECIDED TO ADOPT TWO KITTENS FROM THE ANIMAL SHELTER
audio/train_00944.wav,THE RECIPE CALLS FOR FIVE CUPS OF FLOUR
audio/train_00945.wav,HE WANTED TO BUY ONE BOOK FROM THE STORE
audio/train_00946.wav,THEY FOUND FIVE DIFFERENT SPECIES OF BIRDS IN THE FOREST
audio/train_00947.wav,IT TOOK THEM EIGHT ATTEMPTS TO FINALLY SOLVE THE COMPLEX PUZZLE
audio/train_00948.wav,SHE WON SIX AWARDS FOR HER ACADEMIC ACHIEVEMENTS
audio/train_00949.wav,HE WON FIVE CONSECUTIVE MATCHES IN THE TENNIS TOURNAMENT
audio/train_00950.wav,THEY STAYED IN SIX DIFFERENT HOTELS DURING THEIR ROAD TRIP
audio/train_00951.wav,NEED TO LEAVE FOR THE TRAIN STATION IN FOUR HOURS
audio/train_00952.wav,THEY DECIDED TO CUT OUT ALL PROCESSED FOODS AND EAT A ZERO ADDITIVE DIET
audio/train_00953.wav,SHE HAD SIX DIFFERENT MUSICAL INSTRUMENTS TO PLAY WITH
audio/train_00954.wav,THEY WERE ONLY EIGHT POUNDS AWAY FROM THEIR GOAL WEIGHT
audio/train_00955.wav,THEY HAD TO MAKE EIGHT DIFFERENT STOPS ON THEIR ROAD TRIP
audio/train_00956.wav,THEY HAD SEVEN GUESTS AT THE DINNER PARTY
audio/train_00957.wav,ONE CANNOT ACHIEVE GREATNESS WITHOUT HARD WORK AND DEDICATION
audio/train_00958.wav,THE FIVE FRIENDS WENT ON A ROAD TRIP ACROSS THE COUNTRY
audio/train_00959.wav,THE ARTIST HAD BEEN WORKING ON THE PAINTING FOR EIGHT MONTHS
audio/train_00960.wav,SHE HAD TO READ FOUR BOOKS FOR HER ENGLISH CLASS
audio/train_00961.wav,THE TEAM HAD BEEN TRAINING FOR EIGHT HOURS STRAIGHT
audio/train_00962.wav,IT WOULD TAKE ONE DAY TO DRIVE TO HER DESTINATION
audio/train_00963.wav,THE PROJECT WILL TAKE TWO MONTHS TO COMPLETE
audio/train_00964.wav,SHE CAN SPEAK NINE LANGUAGES FLUENTLY
audio/train_00965.wav,THEY PLANTED SIX APPLE TREES IN THEIR GARDEN
audio/train_00966.wav,IT TOOK ONE MINUTE FOR THE TEAM TO MAKE THEIR DECISION
audio/train_00967.wav,WE DROVE FOR FIVE HOURS STRAIGHT TO GET TO OUR DESTINATION
audio/train_00968.wav,HE WROTE A BOOK WITH NINE CHAPTERS
audio/train_00969.wav,WE ONLY NEED ONE MORE PERSON TO COMPLETE THE TEAM
audio/train_00970.wav,SHE BOUGHT A SET OF FIVE CANDLES WITH DIFFERENT SCENTS
audio/train_00971.wav,THEY STAYED IN SIX DIFFERENT HOTELS DURING THEIR ROAD TRIP
audio/train_00972.wav,THEY CAUGHT SIX FISH IN THE RIVER
audio/train_00973.wav,HE ALWAYS ORDERS A NINE INCH PIZZA WHEN HE IS HUNGRY
audio/train_00974.wav,THE SEVEN DWARFS IN SNOW WHITE ARE ICONIC CHARACTERS
audio/train_00975.wav,SHE NEEDS TO TAKE TWO PILLS EVERY MORNING FOR HER HEALTH
audio/train_00976.wav,SHE HAD SIX DIFFERENT JOBS BEFORE FINDING HER DREAM JOB
audio/train_00977.wav,SHE SPENT SIX WEEKS VOLUNTEERING AT AN ANIMAL SHELTER
audio/train_00978.wav,THE CHEF USED EIGHT DIFFERENT SPICES TO CREATE THAT DISH
audio/train_00979.wav,SHE HAD TO STUDY SIX DIFFERENT SUBJECTS FOR HER UPCOMING EXAMS
audio/train_00980.wav,SHE BOUGHT THREE NEW DRESSES FOR THE WEDDING
audio/train_00981.wav,HE RECEIVED NINE BIRTHDAY CARDS IN THE MAIL
audio/train_00982.wav,THEY HAD TO CANCEL THE EVENT DUE TO ZERO TICKET SALES
audio/train_00983.wav,SHE WAS EIGHT YEARS OLD WHEN SHE FIRST DISCOVERED HER LOVE FOR MUSIC
audio/train_00984.wav,SHE WORKED NINE HOURS A DAY
audio/train_00985.wav,THEY HAD TO ATTEND THREE DIFFERENT WEDDINGS IN THE SAME MONTH
audio/train_00986.wav,THEY WAITED FOR THREE HOURS IN THE QUEUE TO GET TICKETS FOR THE CONCERT
audio/train_00987.wav,THERE ARE SEVEN DAYS IN A WEEK
audio/train_00988.wav,DURING THEIR FASTING PERIOD ZERO CALORIES WERE CONSUMED
audio/train_00989.wav,HE HAD TO ATTEND SIX DIFFERENT JOB INTERVIEWS
audio/train_00990.wav,THE ARTIST HAD BEEN WORKING ON THE PAINTING FOR EIGHT MONTHS
audio/train_00991.wav,THEY WERE ONLY EIGHT POUNDS AWAY FROM THEIR GOAL WEIGHT
audio/train_00992.wav,THEY WERE ONLY EIGHT SECONDS AWAY FROM BEATING THE WORLD RECORD
audio/train_00993.wav,SHE RECEIVED NINE BIRTHDAY CARDS IN THE MAIL
audio/train_00994.wav,THEY WERE ABLE TO CATCH SEVEN FISH IN THE LAKE
audio/train_00995.wav,SHE HAD TO WRITE SIX DIFFERENT ESSAYS FOR HER COLLEGE APPLICATIONS
audio/train_00996.wav,BOUGHT THREE NEW DRESSES FOR THE WEDDING
audio/train_00997.wav,THE TEAM WAS SPLIT INTO TWO GROUPS FOR THE CHALLENGE
audio/train_00998.wav,SHE IS ONE OF THE MOST GENEROUS PEOPLE I HAVE EVER MET
audio/train_00999.wav,WE SAW TWO DOLPHINS SWIMMING IN THE OCEAN THIS MORNING
audio/train_01000.wav,THEY STAYED IN THE HOTEL ROOM FOR SEVEN NIGHTS
audio/train_01001.wav,THEY WERE ONLY EIGHT PAGES AWAY FROM FINISHING THE BOOK
audio/train_01002.wav,THEY READ SEVEN BOOKS OVER THE SUMMER AND FELT PROUD OF THEIR ACCOMPLISHMENT
audio/train_01003.wav,THEY GOT A SCORE OF ZERO FOR NOT FOLLOWING THE INSTRUCTIONS
audio/train_01004.wav,HE COOKED SIX DIFFERENT DISHES FOR HIS DINNER PARTY
audio/train_01005.wav,THE BOOK HAS TWO DIFFERENT ENDINGS
audio/train_01006.wav,HE HAD TO ATTEND SIX DIFFERENT JOB INTERVIEWS
audio/train_01007.wav,SHE FOUND THREE SEASHELLS ON THE BEACH
audio/train_01008.wav,HE HAD SIX DIFFERENT CARS THROUGHOUT HIS LIFE
audio/train_01009.wav,HE WAS ABLE TO RUN A MARATHON WITH ZERO TRAINING
audio/train_01010.wav,SHE WAS EMBARRASSED TO RECEIVE ZERO VOTES IN THE SCHOOL ELECTION
audio/train_01011.wav,WE SAW NINE DIFFERENT SPECIES OF BIRDS DURING OUR HIKE
audio/train_01012.wav,AN OCTOPUS HAVE EIGHT TENTACLES
audio/train_01013.wav,SHE SCORED NINE FOR THE QUIZ
audio/train_01014.wav,WE HAD TO WALK FIVE MILES TO GET TO THE NEAREST TOWN
audio/train_01015.wav,HE HAD TO PAY FOUR TIMES THE NORMAL PRICE FOR THE CONCERT TICKETS
audio/train_01016.wav,THE RECIPE CALLS FOR FIVE CUPS OF FLOUR
audio/train_01017.wav,THE PAINTING FEATURED THREE BOATS ON A CALM BLUE SEA
audio/train_01018.wav,SHE WROTE A FIVE PAGE ESSAY ON THE IMPACT OF CLIMATE CHANGE ON MARINE LIFE
audio/train_01019.wav,FIVE SIBLINGS AND ALL THEM ARE YOUNGER THAN HIM
audio/train_01020.wav,HE WANTED TO BUY ONE BOOK FROM THE STORE
audio/train_01021.wav,IT WOULD TAKE ONE DAY TO DRIVE TO HER DESTINATION
audio/train_01022.wav,THE CHEF USED EIGHT DIFFERENT SPICES TO CREATE THAT DISH
audio/train_01023.wav,THEY TOOK A NINE HOUR FLIGHT TO GET TO LONDON
audio/train_01024.wav,HE HAD SIX DIFFERENT CARS THROUGHOUT HIS LIFE
audio/train_01025.wav,HE WROTE A BOOK WITH NINE CHAPTERS
audio/train_01026.wav,THEY SPENT EIGHT HOURS DRIVING ACROSS THE COUNTRY
audio/train_01027.wav,HE BOUGHT A NINE VOLT BATTERY FOR HIS TORCH LIGHT
audio/train_01028.wav,THEY FOUND SEVEN DIFFERENT SPECIES OF BIRDS IN THE PARK
audio/train_01029.wav,JOHN HAS FIVE SIBLINGS AND ALL THEM ARE YOUNGER THAN HIM
audio/train_01030.wav,THEY ONLY HAD SEVEN MINUTES TO GET READY BEFORE LEAVING
audio/train_01031.wav,SHE HAD TO WORK EIGHT HOUR SHIFTS AT THE HOSPITAL
audio/train_01032.wav,SHE HAD TO WORK EIGHT HOUR SHIFTS AT THE HOSPITAL
audio/train_01033.wav,HE NEEDED TWO MORE POINTS TO WIN THE GAME
audio/train_01034.wav,HE WAS ABLE TO LIFT A HEAVY WEIGHT WITH ZERO STRAIN ON HIS BACK
audio/train_01035.wav,HE RECEIVED SIX NAME CARDS IN THE COMPANY EVENT TODAY
audio/train_01036.wav,THEY HAD TO CANCEL THE EVENT DUE TO ZERO TICKET SALES
audio/train_01037.wav,THEY HAD TO COMPLETE THREE LAPS AROUND THE TRACK BEFORE THE RACE WAS OVER
audio/train_01038.wav,THE COMPANY HAD TO LAY OFF THREE EMPLOYEES DUE TO BUDGET CUTS
audio/train_01039.wav,THEY HAD TO COMPLETE THREE LAPS AROUND THE TRACK BEFORE THE RACE WAS OVER
audio/train_01040.wav,HE WON NINE MATCHES IN A ROW
audio/train_01041.wav,BOTH OF THEM HAVE TWO OLDER SIBLINGS
audio/train_01042.wav,BOTH OF THEM HAVE TWO OLDER SIBLINGS
audio/train_01043.wav,SHE NEEDS TO TAKE TWO PILLS EVERY MORNING FOR HER HEALTH
audio/train_01044.wav,THEY WATCHED A FEW MOVIES THAT LASTED NINE HOURS LONG
